2020/04/11 11:11:39,75,경상북도 경산시,33160,"이번 주말에도 사회적거리두기 실천, 투표소 갈 때 꼭 마스크 착용, 발열, 인후통 증상시 외출하지 마시고 보건소(810-6641~2)로 상담 바랍니다.",cbs,경산시청,810-6641~2,,"[('실천 투표소 마스크', 0.6303)]"
2020/04/10 11:41:08,75,경상북도 경산시,33081,"나 하나쯤이야 하는 생각보다 나 먼저 “사회적 거리두기” 실천, 투표소에 갈 때 마스크를 꼭 착용하세요.",cbs,경산시청,,,"[('실천 투표소에', 0.4914)]"
2020/04/09 17:52:26,75,경상북도 경산시,33038,"사회적 거리두기가 코로나19 조기종식 최선의 방법, 하루 빨리 우리 아이들이 학교에 갈 수 있도록 경산 시민의 힘을 모읍시다.",cbs,경산시청,,,"[('거리두기가 코로나19', 0.7345)]"
2020/04/07 14:42:46,75,경상북도 경산시,32882,"국가적인 재난 코로나19로부터 해방은 사회적 거리두기, 하루빨리 일상으로 복귀 할 수 있도록 다시 한번 경산시민의 힘을 모읍시다.",cbs,경산시청,,,"[('코로나19로부터 해방은', 0.7443)]"
2020/04/06 09:01:03,75,경상북도 경산시,32791,"치료보다 더 좋은 “사회적 거리두기” 내 가족, 내 이웃의 생명을 살리는 일, 나부터 꼭 실천합시다.",cbs,경산시청,,,"[('가족 이웃의', 0.5782)]"
2020/04/05 08:02:26,75,경상북도 경산시,32678,"오늘은 집단감염이 매우 높은 일요일로 다중이용시설, 집회, 종교행사 자제와 건조경보 발령 중 산불예방에 협조하여 주시기 바랍니다.",cbs,경산시청,,,"[('집회 종교행사 자제와 건조경보', 0.5738)]"
2020/04/04 16:31:06,75,경상북도 경산시,32641,"사회적 거리두기 적극 동참에 감사를 드리며, 2주간 연장된 4.19.까지 다시 한번 경산시민의 적극적인 참여 부탁드립니다.",cbs,경산시청,,,"[('한번 경산시민의 적극적인 참여', 0.6844)]"
2020/04/04 11:09:36,75,경상북도 경산시,32574,"주말 사회적 거리두기, 천명, 한식, 산불예방 등 코로나와 산불로부터 경산을 지킵시다.",cbs,경산시청,,,"[('사회적 거리두기', 0.6417)]"
2020/04/03 16:11:27,75,경상북도 경산시,32477,"경산시 현재 건조경보 발령 중, 주말(청명·한식)동안 산불발생 우려, 입산 시 화기소지나 성묘 시 유품소각 등 산불이 발생하지 않도록 주의바랍니다.",cbs,경산시청,청명·한식,,"[('산불발생 우려 입산', 0.631)]"
2020/04/01 10:42:30,75,경상북도 경산시,32147,동지역 출생연도별 5부제(요일제) 신청접수(읍면지역은 문의 후 방문),cbs,경산시청,요일제,,"[('문의 방문', 0.4242)]"
2020/03/31 17:13:07,75,경상북도 경산시,32064,①신청기간:2020.4.1.~4.29 ②신청방법:주소지 읍면동 신청접수 / 시청 홈페이지 참조,cbs,경산시청,,,"[('홈페이지 참조', 0.4791)]"
2020/03/30 17:20:25,75,경상북도 경산시,31939,"사회적 거리두기 캠페인은 경산시민의 실천 약속, 경산시민의 단합된 행동으로 코로나19 조기 종식시킵시다.",cbs,경산시청,,,"[('사회적 거리두기 캠페인은', 0.7749)]"
2020/03/28 10:36:50,75,경상북도 경산시,31596,"②신용등급,상품별 대출한도 상이/자세한 내용 소상공인시장진흥공단 홈페이지 참고",cbs,경산시청,,,"[('②신용등급 상품별', 0.5182)]"
2020/03/28 10:36:16,75,경상북도 경산시,31595,①직접대출(온라인사전예약)/일반대출(시중은행방문)선택,cbs,경산시청,온라인사전예약,,"[('①직접대출 온라인사전예약', 0.3634)]"
2020/03/28 09:01:47,75,경상북도 경산시,31582,"주말 ""사회적 거리두기"" 실천은 코로나19 조기종식을 위한 지름길, 경산시민의 적극적인 동참 꼭 바랍니다.",cbs,경산시청,,,"[('지름길 경산시민의', 0.6106)]"
2020/03/27 14:51:13,75,경상북도 경산시,31487,코로나19 예방을 위해 3월 해외입국자는 발열(37.5℃) 및 호흡기 증상이 있을 경우 경산시보건소 선별진료소(053-810-6309)로 방문바랍니다.,cbs,경산시청,37.5℃,,"[('해외입국자는 발열 37', 0.5198)]"
2020/03/24 12:03:03,75,경상북도 경산시,31110,"우리 아이들이 학교에 갈 수 있도록, 4월 5일까지 사회적 거리두기 캠페인에 경산시민이 앞장섭시다.",cbs,경산시청,,,"[('있도록 4월 5일까지', 0.5435)]"
2020/03/23 10:53:51,75,경상북도 경산시,30994,"4월 5일까지 시행되는 사회적 거리두기 실천은 우리 경산을 살리는 길, 전 시민 반드시 동참하여 코로나19 종식시킵시다.",cbs,경산시청,,,"[('반드시 동참하여 코로나19', 0.6312)]"
2020/03/21 19:37:19,75,경상북도 경산시,30812,3.22.~4.5.까지 2주간 사회적 거리두기 캠페인을 집중 실시하니 전 시민 꼭 참여하여 코로나19 종식시킵시다.,cbs,경산시청,,,"[('까지 2주간 사회적 거리두기', 0.5082)]"
2020/03/18 17:23:29,75,경상북도 경산시,30406,"내일 오전 9시~오후 6시까지 우리지역 태풍급 강풍 90km/h(25m/s) 예상되니 천막, 비닐하우스, 입간판 등 시설물관리 주의바랍니다.",cbs,경산시청,25m/s,,"[('비닐하우스 입간판 시설물관리', 0.4945)]"
2020/03/16 16:59:52,75,경상북도 경산시,30168,"최근 14일 이내 코로나19 다수발생국가(이란, 이탈리아, 스페인 등) 방문자는 의심증상시 즉시 보건소(053-810-6309)로 상담바랍니다.",cbs,경산시청,"이란, 이탈리아, 스페인 등",,"[('810 6309 상담바랍니다', 0.5352)]"
2020/03/15 16:20:47,75,경상북도 경산시,30089,"우리시가 오늘 특별재난지역으로 선포됨, 시민 모두가 다시 한번 힘을 모아 코로나19를 조기에 종식시킵시다.",cbs,경산시청,,,"[('모두가 다시', 0.724)]"
2020/03/14 10:56:28,75,경상북도 경산시,29953,"코로나19 주말 감염 확산 매우 높음, 모임, 집회 예배, 다중시설 이용 자제 등 당분간 외출 자제 협조바랍니다.",cbs,경산시청,,,"[('주말 감염', 0.6305)]"
2020/03/12 19:39:00,75,경상북도 경산시,29782,"경산시의 코로나 현황, 확진자 이동경로, 공적마스크판매 약국 등 정보는 경산시 홈페이지를 참고바랍니다. www.gbgs.go.kr/corona.jsp",cbs,경산시청,,,"[('정보는 경산시 홈페이지를', 0.6016)]"
2020/03/11 07:52:21,75,경상북도 경산시,29561,"오늘은 출생연도 끝자리 3이나 8인 분의 마스크 구입일, 사회적 거리두기 실천으로 코로나19 종식 시킵시다.",cbs,경산시청,,,"[('마스크 구입일 사회적', 0.6527)]"
2020/03/10 18:35:17,75,경상북도 경산시,29524,"내일은 출생연도 끝자리 3이나 8인 분의 마스크 구매일이며, 공적마스크 판매처는 경산시 홈페이지 참고바랍니다.",cbs,경산시청,,,"[('구매일이며 공적마스크', 0.6608)]"
2020/03/10 11:41:45,75,경상북도 경산시,29461,"콜센터, 금융기관, 보험회사, 종교단체 등의 집합교육, 예배 등은 감염병 전염 우려가 매우 높으니 사회적 거리두기 캠페인에 적극 동참합시다.",cbs,경산시청,,,"[('적극 동참합시다', 0.7501)]"
2020/03/10 08:18:38,75,경상북도 경산시,29421,"오늘은 출생연도 끝자리 2와7인 분 마스크 구입일, 공적판매처는 경산시홈페이지 게재, 성숙한 시민의식으로 코로나19 종식시킵시다.",cbs,경산시청,,,"[('공적판매처는 경산시홈페이지 게재', 0.635)]"
2020/03/09 18:16:50,75,경상북도 경산시,29393,"마스크5부제 시행 협조에 감사드리며 내일은 출생연도 끝자리 2와7이 대상이며 코로나19 확산방지, 조기종식을 위해 예방수칙준수 등 협조해주시기 바랍니다",cbs,경산시청,,,"[('시행 협조에 감사드리며 내일은', 0.5957)]"
2020/03/09 07:54:28,75,경상북도 경산시,29325,"오늘은 출생연도 끝자리 1과 6인분은 마스크 구매날(신분증 지참), 공적판매소는 경산시 홈페이지 게재, 예방수칙 준수로 코로나19 조기에 극복합시다.",cbs,경산시청,신분증 지참,,"[('오늘은 출생연도 끝자리 1과', 0.6193)]"
2020/03/08 20:12:38,75,경상북도 경산시,29314,"3월9일(월)은 출생연도 끝자리1과6인분들이 공적판매소에서 마스크를 구매 할수 있습니다(1인당 주2매 구매가능,신분증지참,안내1577-1255→내선5)",cbs,경산시청,월,,"[('1255 내선5', 0.5399)]"
2020/03/08 20:10:34,75,경상북도 경산시,29312,"공적마스크 출생연도 5부제 판매 시행, 3월9일부터 1주 1인 2매 구매제한, 신분증 지참, 공적판매소(경산시홈페이지 게재)에서 구입 할 수 있습니다.",cbs,경산시청,경산시홈페이지 게재,,"[('지참 공적판매소', 0.6286)]"
2020/03/08 08:03:29,75,경상북도 경산시,29172,"오늘은 일요일로 다중집회, 모임예배 등 집단감염 우려가 매우 높으니 코로나19 확산방지를 위하여 자제하여 주시기 바랍니다.",cbs,경산시청,,,"[('우려가 매우 높으니', 0.6736)]"
2020/03/07 17:56:40,75,경상북도 경산시,29134,"당분간 외출, 모임, 다중이용시설 이용자제 동참, 예방수칙 준수, 시민의 결속된 힘으로 코로나19 극복합시다.",cbs,경산시청,,,"[('당분간 외출', 0.6723)]"
2020/03/07 14:07:27,75,경상북도 경산시,29081,"다중이용시설 출입 및 단체 종교예배 자제, 개인위생수칙 준수 ※발열, 기침, 호흡기증상 등 의심증상 시 1339나 선별진료소에 상담바랍니다.",cbs,경산시청,,,"[('호흡기증상 의심증상', 0.6382)]"
2020/03/02 17:09:33,75,경상북도 경산시,28152,"다중밀집시설 출입자제, 종교시설 예배 당분간 중단, 마스크 착용, 손씻기 등 개인위생수칙 이행, 코로나19 예방에 동참바랍니다.",cbs,경산시청,,,"[('개인위생수칙 이행 코로나19 예방에', 0.6615)]"
2020/03/01 11:47:00,75,경상북도 경산시,27826,"발열, 기침, 호흡기증상 등 의심증상 시 1339나 선별진료소에 상담바랍니다, 전 시민의 예방수칙 준수 극복가능, 협조바랍니다.",cbs,경산시청,,,"[('시민의 예방수칙', 0.5254)]"
2020/02/29 11:54:43,75,경상북도 경산시,27445,코로나19 예방 ▶손씻기 ▶기침예절 준수 ▶사람 많은 곳 자제 ▶발열 및 호흡기 증상자 접촉 피하기 ※의심증상 시 1339나 선별진료소에 상담바랍니다,cbs,경산시청,,,"[('자제 발열 호흡기', 0.6547)]"
2020/02/27 17:59:28,75,경상북도 경산시,27040,"발열·기침 등 의심증상 시 1339나 선별진료소 보건소(810-6309), 경산중앙병원(715-0119), 세명병원(819-8500)에 상담바랍니다.",cbs,경산시청,810-6309,,"[('발열 기침 의심증상 1339나', 0.6701)]"
2020/02/26 16:08:46,75,경상북도 경산시,26693,코로나19 발생현황 및 확진자 동선은 시청홈페이지에 게재하였으니 참고하시기 바랍니다. ※의심증상시 선별 진료소나 1339로 상담바랍니다.,cbs,경산시청,,,"[('참고하시기 바랍니다 의심증상시 선별', 0.4867)]"
2020/02/26 16:06:05,75,경상북도 경산시,26692,"선별진료소는 보건소(810-6314),경산중앙병원(715-0119),세명병원(819-8500)입니다, 방문전 1339나 선별진료소에 문의하시기 바랍니다",cbs,경산시청,810-6314,,"[('경산중앙병원 715 0119', 0.5753)]"
2020/02/26 12:00:46,75,경상북도 경산시,26630,"코로나19예방, 손씻기, 기침예절 준수, 씻지 않은 손 얼굴 만지지 않기, 마스크 착용, 사람 많은 곳 가지 않기, 호흡기 증상자와 접촉 피하기바랍니다",cbs,경산시청,,,"[('증상자와 접촉', 0.6605)]"
2020/02/25 17:57:38,75,경상북도 경산시,26475,감염병 예방수칙 ▶비누로 30초 이상 손씻기▶기침할땐 옷소매로 입·코 가리기▶호흡기증상시 마스크 착용 ※의심증상시 선별진료소나 1339로 상담바랍니다,cbs,경산시청,,,"[('30초 이상 손씻기 기침할땐', 0.6661)]"
2020/02/24 16:33:38,75,경상북도 경산시,26132,"시청홈페이지 게시 확진자 동선은 소독 후 안심하고 이용가능, 기침·고열 등 의심증상 시 1339나 경산시보건소로 상담바랍니다.",cbs,경산시청,,,"[('게시 확진자 동선은', 0.6474)]"
2020/02/23 19:26:47,75,경상북도 경산시,25913,코로나19 발생현황 및 확진자 동선은 시청홈페이지 게재. 소독 후 다음날 자정 이후 안심. 예방수칙 준수바랍니다.,cbs,경산시청,,,"[('이후 안심', 0.6058)]"
2020/02/21 11:47:04,75,경상북도 경산시,25513,경산시 코로나19 추가확진 발생. 확산방지를 위해 예방수칙 준수와 의심증상 발생시 경산시보건소(810-6309)나 1339로 상담바랍니다,cbs,경산시청,810-6309,,"[('준수와 의심증상 발생시 경산시보건소', 0.6273)]"
2020/02/20 13:33:39,75,경상북도 경산시,25453,"경산시 코로나19확진자 발생. 다중이용시설 이용 및 모임 자제, 위생수칙준수와 의심증상 발생시 경산시보건소(810-6309)나 1339로 상담바랍니다",cbs,경산시청,810-6309,,"[('발생 다중이용시설 이용 모임', 0.6038)]"
2020/02/18 18:49:48,75,경상북도 경산시,25413,"코로나19 예방을 위해, 손씻기, 마스크착용, 기침예절 준수 및 발열, 기침 등 의심증상 발생시 경산시보건소(810-6309)나 1339로 상담바랍니다",cbs,경산시청,810-6309,,"[('준수 발열 기침 의심증상', 0.5368)]"
2019/05/22 10:51:09,75,경상북도 경산시,24438,"오늘 오전09:42 경산시 자인면 공장폭발 사고로 화재 발생, 인근주민은 대피하시기 바랍니다.(053-810-5637)",cbs,경산시청,053-810-5637,,"[('자인면 공장폭발 사고로 화재', 0.5855)]"
2017/11/15 17:09:14,75,경상북도 경산시,3105,오늘 14:29분 포항북구북쪽9km지역 규모5.4지진발생. 여진이 계속 발생중이니 안전에 주의하시기 바랍니다.(810-5599),cbs,경산시청,810-5599,,"[('포항북구북쪽9km지역 규모5 4지진발생 여진이', 0.5495)]"
