2020/12/04 15:23:29,75,경상북도 경산시,70035,"전국적으로 코로나19 확진자 다수 발생. 타지역 방문 자제, 외부인 접촉시 반드시 마스크 착용해 주시고 의심증상이 있을 시 신속히 검사받기 바랍니다.",cbs,경산시청,,,"[('반드시 마스크 착용해 주시고', 0.6829)]"
2020/11/28 17:15:00,75,경상북도 경산시,68417,"11월28일 확진자 1명 발생(자가격리해제 전 검사)/이동동선 없음/불필요한 외출·모임은 자제, 마스크착용, 주기적 환기·소독 등 방역수칙을 지켜주세요",cbs,경산시청,자가격리해제 전 검사,,"[('마스크착용 주기적 환기', 0.6847)]"
2020/11/27 15:35:28,75,경상북도 경산시,68013,11월27일 확진자2명 발생(타지역 확진자 접촉)/역학조사중/마스크착용 등 방역수칙 준수 및 코로나19 의심증상 시 선별진료소에서 검사받으시기 바랍니다,cbs,경산시청,타지역 확진자 접촉,,"[('코로나19 의심증상', 0.6769)]"
2020/11/25 11:37:09,75,경상북도 경산시,67289,"11월 24일 해외입국자 1명 확진 판정/ 이동동선 없음/ 손씻기 및 마스크 착용 생활화, 모임활동 자제 등 생활방역수칙을 철저히 지켜주시기 바랍니다.",cbs,경산시청,,,"[('판정 이동동선 없음', 0.5429)]"
2020/11/24 14:01:05,75,경상북도 경산시,67048,가족·지인·소규모 모임 및 단체 식사를 가급적 자제하고 코로나19 의심증상 발생시 다른 장소를 방문하지 마시고 즉시 보건소 선별진료소로 방문바랍니다.,cbs,경산시청,,,"[('단체 식사를 가급적 자제하고', 0.5338)]"
2020/11/19 15:48:16,75,경상북도 경산시,65778,11.19. 확진자3명 발생. 연이어 확진자가 발생하고 있어 가족·지인·회사 등 모임을 자제바라며 마스크쓰기 및 방역수칙을 철저히 지켜주시기 바랍니다,cbs,경산시청,,,"[('발생 연이어', 0.6204)]"
2020/11/18 15:24:31,75,경상북도 경산시,65494,"11.18. 확진자 3명 발생. 역학조사 중/ 불필요한 모임 활동 자제, 다중이용시설 방문시 개인방역수칙을 철저히 지켜주시기 바랍니다.",cbs,경산시청,,,"[('방문시 개인방역수칙을 철저히 지켜주시기', 0.6824)]"
2020/11/16 12:47:42,75,경상북도 경산시,64945,"로터스101 방역수칙 준수함. 방역소독 조치완료, 정상영업 가능. 다중이용시설 이용 시 손씻기 및 마스크착용 등 개인 방역수칙 준수 하시기 바랍니다.",cbs,경산시청,,,"[('방역소독 조치완료', 0.728)]"
2020/11/16 11:00:35,75,경상북도 경산시,64923,타지역확진자방문동선/11.7. 13시~13시40분 경산시 로터스101 웨딩예식장 1층뷔페식당 이용자중 증상이 있을 경우 보건소선별진료소에서 검사바랍니다,cbs,경산시청,,,"[('이용자중 증상이', 0.6074)]"
2020/11/12 16:39:54,75,경상북도 경산시,64198,"11월11일 확진자 1명 발생/이동동선 파악 및 소독조치 완료함/손씻기 및 마스크 착용, 모임 활동 자제 등 생활방역수칙을 철저히 지켜주시기 바랍니다.",cbs,경산시청,,,"[('착용 모임 활동 자제', 0.6316)]"
2020/11/02 15:02:38,75,경상북도 경산시,63126,"11월 1일 해외입국자 1명 확진 판정/ 관내 이동 동선 없음/마스크 착용 및 손씻기, 생활 속 거리두기 등 방역수칙을 꼭 준수해 주시기 바랍니다.",cbs,경산시청,,,"[('생활 거리두기', 0.4405)]"
2020/10/23 11:55:41,75,경상북도 경산시,62147,"예방접종은 건강상태가 좋은 날/접종후 15-30분간 몸상태 관찰/당뇨,고혈압 등 기저질환이 있는 경우 다니던 병원에서 사전문의후 접종하세요.",cbs,경산시청,,,"[('건강상태가 좋은 접종후', 0.6395)]"
2020/10/20 10:02:11,75,경상북도 경산시,61870,"10월 19일 해외입국자 1명 확진 판정/ 관내 이동 동선 없음/ 마스크 착용 및 손씻기, 생활속 거리두기 등 방역수칙을 꼭 준수해 주십시오.",cbs,경산시청,,,"[('판정 관내 이동', 0.651)]"
2020/10/19 13:38:21,75,경상북도 경산시,61816,"10월18일 해외입국자 1명 확진 판정/ 관내 이동 동선 없음/ 마스크 착용 및 손씻기, 생활 속 거리두기 등 방역 수칙을 꼭 준수해 주십시오.",cbs,경산시청,,,"[('이동 동선 없음', 0.6399)]"
2020/10/12 16:40:38,75,경상북도 경산시,61235,독감접종일정변경안내 만13~18세 10.13부터 만70세이상 10.19부터 만62~69세 10.26부터 권장기간내 위탁의료기관에서 접종바랍니다.,cbs,경산시청,,18세,"[('위탁의료기관에서 접종바랍니다', 0.6131)]"
2020/10/04 11:58:53,75,경상북도 경산시,60239,10월3일 해외입국자 1명 확진판정/ 관내 이동 동선 없음/ 마스크 착용 및 손씻기 등 생활방역수칙을 철저히 준수 바랍니다.,cbs,경산시청,,,"[('확진판정 관내', 0.6174)]"
2020/09/19 16:32:01,75,경상북도 경산시,57831,9.19 해외입국자 1명 확진 / 관내 이동동선 없음 / 소독 등 대응조치 완료함 / 마스크 착용 및 손씻기 등 생활방역수칙을 철저히 준수바랍니다.,cbs,경산시청,,,"[('1명 확진 관내', 0.6606)]"
2020/09/16 11:35:16,75,경상북도 경산시,57174,"9.15 확진자 1명 발생/관내동선 파악 및 소독조치 완료/사업설명회 참석, 모임활동 자제 및 마스크착용, 손씻기 등 방역수칙을 철저히 준수바랍니다.",cbs,경산시청,,,"[('발생 관내동선 파악', 0.6972)]"
2020/09/12 15:35:18,75,경상북도 경산시,56514,9월12일 확진자 1명 발생/자가격리 해제 전 검사 양성판정/관내 이동동선 없음/마스크 착용 및 손씻기 등 생활방역수칙을 철저히 지켜주시기 바랍니다.,cbs,경산시청,,,"[('검사 양성판정 관내 이동동선', 0.6411)]"
2020/09/11 18:25:12,75,경상북도 경산시,56305,긴급) 방문판매 관련 행사 및 각종 설명회를 통한 감염 확산 중 / 참석자제 및 참석 후 증상이 있으면 검사 받으시기 바랍니다.,cbs,경산시청,,,"[('각종 설명회를 통한', 0.7346)]"
2020/09/07 17:49:50,75,경상북도 경산시,55396,"금호강 수위가 높아 현재도, 하양읍 대부잠수교를 통제하고 있사오니, 통행차량 등은 우회하여 주시기 바랍니다.",cbs,경산시청,,,"[('높아 현재도', 0.7278)]"
2020/09/07 16:45:48,75,경상북도 경산시,55380,9월7일 해외입국자 1명 확진 판정/관내 이동동선 없음/소독 등 대응조치 완료함/마스크 착용 및 손씻기 등 생활방역수칙을 철저히 지켜주시기 바랍니다.,cbs,경산시청,,,"[('대응조치 완료함 마스크', 0.6646)]"
2020/09/07 12:27:38,75,경상북도 경산시,55276,"금호강 수위 상승으로 하양읍 대부잠수교를 12:25분 부터 차량통제 하오니, 우회하여 주시기 바랍니다.",cbs,경산시청,,,"[('25분 부터 차량통제', 0.5386)]"
2020/09/07 08:44:17,75,경상북도 경산시,55018,"태풍북상에 따라 남천변 교량(공원교,서옥교,백옥교,영대교,경산교) 언더패스 차량통제를 하였사오니, 우회하여 주시기 바랍니다.",cbs,경산시청,"공원교,서옥교,백옥교,영대교,경산교",,"[('주시기 바랍니다', 0.6691)]"
2020/09/07 04:07:03,75,경상북도 경산시,54814,"9.7. 05:00 태풍 '하이선' 북상으로 태풍경보 발효. 불필요한 외출은 자제해주시고, 강풍 및 비로 피해가 발생하지 않도록 유의하시기 바랍니다.",cbs,경산시청,,,"[('발효 불필요한 외출은 자제해주시고', 0.7058)]"
2020/09/06 14:22:52,75,경상북도 경산시,54516,"7일새벽 태풍 예비특보 발표, 시민들께서는 불필요한 외출을 자제해 주시고, 강풍 및 비로 인한 피해가 발생하지 않도록 각별히 유의해 주시기 바랍니다.",cbs,경산시청,,,"[('각별히 유의해', 0.6611)]"
2020/09/03 17:09:52,75,경상북도 경산시,53645,9월3일 확진자 1명 발생/타지역 생활권자로 관내 이동동선 없음/타지역 방문을 자제하시고 반드시 마스크 착용 등 생활방역수칙을 지켜주시기 바랍니다.,cbs,경산시청,,,"[('방문을 자제하시고 반드시', 0.6305)]"
2020/09/02 13:21:25,75,경상북도 경산시,52783,"9.2.13:00 태풍 ‘마이삭’ 북상으로 태풍주의보 발효. 불필요한 외출은 자제해주시고, 강풍 및 비로 피해가 발생하지 않도록 유의해 주시기 바랍니다",cbs,경산시청,,,"[('유의해 주시기 바랍니다', 0.6309)]"
2020/09/02 09:15:00,75,경상북도 경산시,52592,"9.2. 제9호 태풍 ‘마이삭’ 북상중. 시민들께서는 불필요한 외출을 자제해주시고,강풍 및 비로 인한 피해가 발생하지 않도록 유의해 주시기 바랍니다.",cbs,경산시청,,,"[('않도록 유의해 주시기', 0.631)]"
2020/09/01 10:28:10,75,경상북도 경산시,52255,8월31일 해외입국자 1명 확진판정/ 관내 이동동선 없음/ 소독 등 대응조치 완료함/ 마스크착용 및 손씻기 등 생활방역수칙을 철저히 지켜주시기 바랍니다,cbs,경산시청,,,"[('소독 대응조치 완료함', 0.6499)]"
2020/08/31 11:40:11,75,경상북도 경산시,52017,"대구 동구 사랑의교회 코로나19 확진자 다수 발생, 집합·모임·행사를 자제해 주시고 반드시 마스크 착용, 손씻기 등 생활방역수칙을 철저히 준수합시다.",cbs,경산시청,,,"[('자제해 주시고 반드시 마스크', 0.7175)]"
2020/08/31 11:06:39,75,경상북도 경산시,52007,"오늘(8.31) 우리지역 폭염주의보 발효 중. 온열질환 예방, 한낮 야외활동 자제, 충분한 휴식 등 건강관리에 유의하여 주시기 바랍니다.",cbs,경산시청,8.31,,"[('우리지역 폭염주의보', 0.6332)]"
2020/08/30 17:51:07,75,경상북도 경산시,51839,"대구 동구 사랑의교회 코로나19 확진자 다수 발생, 집합·모임·행사를 자제해 주시고 마스크 착용, 손씻기 등 방역수칙을 준수합시다.",cbs,경산시청,,,"[('동구 사랑의교회 코로나19 확진자', 0.7402)]"
2020/08/30 12:37:37,75,경상북도 경산시,51707,"경산시 폭염경보 발효, 물 마시기 등 온열질환 예방과 손씻기, 마스크 착용 등 생활방역 수칙을 준수하여 주시기바랍니다.",cbs,경산시청,,,"[('마시기 온열질환 예방과 손씻기', 0.7718)]"
2020/08/28 16:48:51,75,경상북도 경산시,50913,"코로나19 추가 확산 방지를 위해 불필요한 모임 자제, 마스크 착용, 손씻기, 2m이상 거리두기 등 방역수칙을 꼭 실천하여 주시기 바랍니다.",cbs,경산시청,,,"[('마스크 착용', 0.6394)]"
2020/08/28 11:20:52,75,경상북도 경산시,50713,"오늘 11:00시 이후 우리지역 폭염경보 발효. 시민들께서는 야외활동 자제, 물 충분히 마시기, 충분한 휴식 등 건강관리에 유의하시기 바랍니다.",cbs,경산시청,,,"[('11 00시 이후', 0.5978)]"
2020/08/27 16:42:24,75,경상북도 경산시,50462,"사회적 거리두기 2단계 격상에 따라 모임·외출·다중이용시설 이용을 자제해 주시고 마스크 착용, 손소독 등 생활방역 수칙을 준수바랍니다.",cbs,경산시청,,,"[('손소독 생활방역', 0.7144)]"
2020/08/27 10:39:47,75,경상북도 경산시,50290,"오늘 12:00시 이후 우리지역 폭염주의보 발효. 시민들께서는 야외활동 자제, 물 충분히 마시기, 충분한 휴식 등 건강관리에 유의하시기 바랍니다.",cbs,경산시청,,,"[('12 00시 이후', 0.6003)]"
2020/08/26 16:53:44,75,경상북도 경산시,49932,"코로나19 확산 방지를 위해 마스크 착용, 손씻기, 2M이상 거리두기 등 방역수칙을 철저히 준수하여 주시기 바랍니다.",cbs,경산시청,,,"[('코로나19 확산 방지를', 0.6542)]"
2020/08/26 11:16:50,75,경상북도 경산시,49636,"제8호태풍 ‘바비’ 북상중. 시민들께서는 불필요한 외출을 자제해 주시고, 강풍 및 비로 인한 피해가 발생하지 않도록 각별히 유의해 주시기 바랍니다.",cbs,경산시청,,,"[('각별히 유의해', 0.7433)]"
2020/08/25 17:51:16,75,경상북도 경산시,49344,"서울 사랑제일교회(8.7.~8.13.), 광복절(8.15.)집회 방문자는 가까운 선별진료소에서 진단검사(검사무료)를 꼭 받아주시기 바랍니다.",cbs,경산시청,8.7.~8.13.,,"[('광복절 15 집회', 0.605)]"
2020/08/24 11:31:57,75,경상북도 경산시,48747,"8.23.자 광복절(8.15.)집회 관련 확진자5명 발생, 접촉자 전수검사 및 자가격리 조치 중. 시민들께서는 마스크 착용 등 예방 수칙 준수 바랍니다",cbs,경산시청,8.15.,,"[('조치 시민들께서는 마스크 착용', 0.6483)]"
2020/08/22 15:18:08,75,경상북도 경산시,47879,"경북행정명령 발동) 서울 사랑제일교회(8.7~8.13), 경복궁 인근(8.8), 광복절(8.15)집회방문자는 선별진료소에 신속히 진단검사를 받기바랍니다",cbs,경산시청,8.7~8.13,,"[('사랑제일교회 13 경복궁', 0.5319)]"
2020/08/21 16:42:27,75,경상북도 경산시,47394,긴급)8.15광화문 집회 참석자 중 확진자가 연일 발생하고 있습니다. 참석자는 증상유무 관계 없이 가까운 선별진료소에서 꼭 검사 받으시기 바랍니다.,cbs,경산시청,,,"[('긴급 15광화문', 0.7128)]"
2020/08/20 18:23:04,75,경상북도 경산시,46990,긴급)8.15.광화문집회 참석자 중 코로나19 확진자 1명 발생/ 8.15.오전7시 경산역 출발 버스7호차 탑승객 전원 선별진료소에서 검사받기 바랍니다,cbs,경산시청,,,"[('오전7시 경산역 출발', 0.6297)]"
2020/08/20 16:02:28,75,경상북도 경산시,46916,"서울 사랑제일교회(8.7~8.13), 경복궁 인근(8.8), 광복절(8.15.)집회 방문자는 보건소 선별진료소에서 코로나19검사를 받기바랍니다.",cbs,경산시청,8.7~8.13,,"[('경복궁 인근 광복절 15', 0.545)]"
2020/08/19 19:04:08,75,경상북도 경산시,46534,8월19일 8.15.집회참석자 확진자1명 발생/관내 동선 없음/대응조치 완료/8.15.집회참석자는 보건소에서 코로나19검사 바람(0538106309),cbs,경산시청,0538106309,,"[('확진자1명 발생 관내 동선', 0.5107)]"
2020/08/19 14:32:44,75,경상북도 경산시,46360,증상유무와 관계없이 보건소 선별진료소에서 신속히 진단검사를 받아주시기 바랍니다(익명검사가능) 0538106039 (2/2),cbs,경산시청,익명검사가능,,"[('증상유무와 관계없이 보건소', 0.5444)]"
2020/08/19 14:32:06,75,경상북도 경산시,46358,"경상북도 행정명령 발동. 서울 성북구 사랑제일교회(8.7.~8.13.), 경복궁 인근(8.8.), 광복절(8.15.) 집회 참가 및 방문자는 (1/2)",cbs,경산시청,8.7.~8.13.,,"[('15 집회 참가', 0.5015)]"
2020/08/11 09:18:02,75,경상북도 경산시,43986,"금일 11:00시 이후 우리지역 폭염경보 발효. 시민들께서는 야외활동 자제, 물 충분히 마시기, 충분한 휴식 등 건강관리에 유의하시기 바랍니다.",cbs,경산시청,,,"[('폭염경보 발효', 0.6704)]"
2020/08/10 12:58:34,75,경상북도 경산시,43801,태풍 제5호 '장미'가 금일 13시 이후 우리지역에 근접통과 예정입니다. 시민들께서는 외출자제 및 하천가 접근금지 등 안전에 주의하시기 바랍니다.,cbs,경산시청,,,"[('이후 우리지역에 근접통과 예정입니다', 0.6868)]"
2020/08/08 14:26:05,75,경상북도 경산시,43229,<산사태 위기경보 심각 발령>집중호우로 산사태 피해 우려지역 산림인근 주민은 유사시 안전한 곳으로 대피하시기 바랍니다.(053-810-5203),cbs,경산시청,053-810-5203,,"[('피해 우려지역 산림인근', 0.6412)]"
2020/08/06 16:35:58,75,경상북도 경산시,42614,"8월5일 해외입국자 확진 판정, 관내 이동동선 없으며 대응조치 완료. 안심하시고 마스크 착용 및 손씻기 등 생활방역수칙을 준수하여 주시기 바랍니다.",cbs,경산시청,,,"[('안심하시고 마스크 착용', 0.7095)]"
2020/08/04 17:00:57,75,경상북도 경산시,42272,"8월3일 자가격리자 중 코로나19 확진판정 1명, 관내 이동동선 없으며 대응조치 완료, 안심하고 마스크 착용, 손씻기 등 생활방역수칙을 준수 바랍니다.",cbs,경산시청,,,"[('1명 관내 이동동선 없으며', 0.7108)]"
2020/06/05 17:56:49,75,경상북도 경산시,37116,"체류자격 없는 외국인에 대해 강제출국 걱정없이 무료 코로나19검사를 실시하니, 증상이 있으면 전화1339나 경산시보건소 810-6309로 문의바랍니다.",cbs,경산시청,,,"[('810 6309로 문의바랍니다', 0.5953)]"
2020/06/01 10:11:39,75,경상북도 경산시,36777,"③5부제 관계없이 신청가능, 자세한 내용은 경산시청 홈페이지 참조 ④아직 신청하지 않으신 분은 신청바랍니다(2/2)",cbs,경산시청,2/2,,"[('경산시청 홈페이지 참조 ④아직', 0.4915)]"
2020/06/01 10:11:11,75,경상북도 경산시,36776,①대상사업: 점포재개장 및 경제회복 지원 ②신청기간: 6월12일까지/경산실내체육관(1/2),cbs,경산시청,1/2,,"[('②신청기간 6월12일까지', 0.337)]"
2020/05/22 13:44:39,75,경상북도 경산시,35994,"장소:읍면동사무소,경산실내체육관 ③5부제 관계없이 신청 가능, 자세한 내용은 경산시청홈페이지 참조 ④아직 신청하지 않으신 분은 신청바랍니다(2/2)",cbs,경산시청,2/2,,"[('관계없이 신청 가능', 0.5323)]"
2020/05/22 13:43:57,75,경상북도 경산시,35993,코로나19피해 소상공인지원 신청안내 ①소상공인 피해지원 -기간:5월29일까지/경산실내체육관 ②소상공인 카드수수료지원 기간:예산소진시까지(1/2),cbs,경산시청,1/2,,"[('①소상공인 피해지원 기간', 0.534)]"
2020/05/19 13:54:53,75,경상북도 경산시,35743,③신청기간:5월29일까지/경산실내체육관 또는 경상북도 홈페이지 ④자세한 내용은 경산시청 홈페이지 참조바람 ⑤문의:810-6933∼6939 (2/2),cbs,경산시청,2/2,,"[('5월29일까지 경산실내체육관 또는 경상북도', 0.4014)]"
2020/05/19 13:54:23,75,경상북도 경산시,35742,"코로나19피해 근로자특별지원(2차)신청 ①대상:무급휴직자,특수형태종사자,프리랜서등 ②지원:최대 월50만원/2개월지원(4월분,3월소급신청분)(1/2)",cbs,경산시청,2차,,"[('②지원 최대 월50만원', 0.5012)]"
2020/05/18 15:57:57,75,경상북도 경산시,35675,체류자격 없는 외국인에게 강제출국 걱정 없이 무료로 코로나19검사를 실시하오니 증상이 있는 경우 반드시 경산시보건소를 찾아주시기 바랍니다.,cbs,경산시청,,,"[('있는 경우 반드시 경산시보건소를', 0.6759)]"
2020/05/15 13:46:04,75,경상북도 경산시,35441,"새로운 일상 생활 속 거리 두기, 아프면 3-4일 집에 머물기, 두팔 간격 건강 거리 두기, 매일 두 번 이상 환기, 거리는 멀어도 마음은 가까이.",cbs,경산시청,,,"[('간격 건강 거리 두기', 0.592)]"
2020/05/14 13:33:16,75,경상북도 경산시,35359,"-선불카드: 읍면동사무소 5.18∼6.18 -신청방법:출생년도 끝자리5부제(월1,6,화2,7,수3,8,목4,9,금5,0) ※세대주신청원칙(2/2)",cbs,경산시청,"월1,6,화2,7,수3,8,목4,9,금5,0",,"[('출생년도 끝자리5부제 월1', 0.5128)]"
2020/05/14 13:32:35,75,경상북도 경산시,35358,"정부긴급재난지원금 신청 안내 -신용·체크카드: 카드사홈페이지(5.11∼5.31), 카드사은행창구(5.18∼6.18) ※온라인신청은 토·일가능(1/2)",cbs,경산시청,5.11∼5.31,,"[('안내 신용', 0.5566)]"
2020/05/12 18:08:07,75,경상북도 경산시,35166,"새로운 일상 생활 속 거리 두기, 아프면 3-4일 집에 머물기, 두팔 간격 건강 거리 두기, 매일 두 번 이상 환기, 거리는 멀어도 마음은 가까이.",cbs,경산시청,,,"[('간격 건강 거리 두기', 0.592)]"
2020/05/12 13:11:46,75,경상북도 경산시,35120,4.24.~5.6.까지 서울시 이태원 지역 방문자는 외출을 자제하시고 증상유무와 관계없이 경산시보건소에 상담 후 코로나19 검사를 받으시기 바랍니다.,cbs,경산시청,,,"[('까지 서울시 이태원 지역', 0.5809)]"
2020/05/11 11:09:00,75,경상북도 경산시,34959,"장소:읍면동사무소,경산실내체육관 ③5부제 관계없이 신청 가능, 자세한 내용은 경산시청홈페이지 참조 ④아직 신청하지 않으신 분은 신청바랍니다(2/2)",cbs,경산시청,2/2,,"[('관계없이 신청 가능', 0.5323)]"
2020/05/11 11:08:00,75,경상북도 경산시,34958,코로나19피해 소상공인지원 신청안내 ①소상공인 피해지원 -기간:5월29일까지/경산실내체육관 ②소상공인 카드수수료지원 기간:예산소진시까지(1/2),cbs,경산시청,1/2,,"[('①소상공인 피해지원 기간', 0.534)]"
2020/05/08 16:20:52,75,경상북도 경산시,34643,"장소:읍면동사무소,경산실내체육관 ③5부제 관계없이 신청 가능, 자세한 내용은 경산시청홈페이지 참조 ④아직 신청하지 않으신 분은 신청바랍니다(2/2)",cbs,경산시청,2/2,,"[('관계없이 신청 가능', 0.5323)]"
2020/05/08 16:20:15,75,경상북도 경산시,34642,코로나19피해 소상공인지원 신청안내 ①소상공인 피해지원 -기간:5월29일까지/경산실내체육관 ②소상공인 카드수수료지원 기간:예산소진시까지(1/2),cbs,경산시청,1/2,,"[('①소상공인 피해지원 기간', 0.534)]"
2020/04/30 10:02:18,75,경상북도 경산시,34267,"코로나19, 화재, 산불, 이번 연휴가 최고도 위험기간이니 사회적 거리두기와 산불예방에 시민 여러분의 협조를 당부드립니다.",cbs,경산시청,,,"[('이번 연휴가 최고도 위험기간이니', 0.6698)]"
2020/04/29 19:17:23,75,경상북도 경산시,34245,"함께하는 사회적 거리두기 경산시민의 약속입니다, 황금연휴에도 외출자제, 2m거리두기 등 예방활동과 건조특보 발효 중으로 산불 조심하시기 바랍니다.",cbs,경산시청,,,"[('발효 중으로 산불 조심하시기', 0.6922)]"
2020/04/29 09:19:40,75,경상북도 경산시,34182,①신청기간:2020.4.1.~4.29. ②신청방법:주소지 읍면동 신청접수 / 시청 홈페이지 참조,cbs,경산시청,,,"[('①신청기간 2020 29', 0.4697)]"
2020/04/25 10:23:30,75,경상북도 경산시,34028,"안동지역 1박 2일 간 산불 진화 중, 경산지역 건조경보 발령, 산불 발생위험이 매우 높으니 소각행위 금지 등 산불 예방에 협조 바랍니다.",cbs,경산시청,,,"[('발령 산불 발생위험이 매우', 0.6954)]"
2020/04/25 08:57:31,75,경상북도 경산시,34013,"사회적 거리두기는 소중한 사람을 지키는 첫 번째 방법, 주말은 감염 위험이 매우 높으므로 마스크 착용, 2m 건강거리 유지, 외출 자제에 동참바랍니다.",cbs,경산시청,,,"[('마스크 착용 2m', 0.6999)]"
2020/04/23 13:48:26,75,경상북도 경산시,33910,지역고용대응 지원사업 신청대상 해당여부는 경산시 홈페이지 지역고용대응 특별지원에 안내되어 있으니 참고하시기 바랍니다.,cbs,경산시청,,,"[('지역고용대응 특별지원에', 0.6256)]"
2020/04/23 11:28:17,75,경상북도 경산시,33909,지역고용대응 지원사업 신청안내(2/2) -신청기간/장소 : 4.29.(수)까지/경산실내체육관 -문의 : 810-6933~9,cbs,경산시청,2/2,,"[('장소 29', 0.4156)]"
2020/04/23 11:27:22,75,경상북도 경산시,33908,"지역고용대응 지원사업 신청안내(1/2) -대상 : 무급휴직근로자, 특수형태근로종사자, 프리랜서 등 -지원액 : 월 최대 50만원",cbs,경산시청,1/2,,"[('무급휴직근로자 특수형태근로종사자', 0.431)]"
2020/04/21 13:22:13,75,경상북도 경산시,33826,"코로나19 조기종식을 위한 사회적 거리두기가 5월 5일까지 연장, 경산시민의 지속적인 참여와 의심 증상 시 즉시 보건소 상담바랍니다.",cbs,경산시청,,,"[('5일까지 연장 경산시민의', 0.6414)]"
2020/04/18 10:04:24,75,경상북도 경산시,33651,"사회적 거리두기 아직 멈출 때가 아닙니다, 이번 주말도 경산시민의 적극적인 참여로 코로나19를 조기에 극복합시다.",cbs,경산시청,,,"[('코로나19를 조기에', 0.7027)]"
2020/04/15 11:35:44,75,경상북도 경산시,33472,"투표소에서는 마스크 착용과 1m 거리두기, 사람과의 접촉이 많았으므로 후각, 미각 이상 등 의심증상시 즉시 보건소로 상담바랍니다.",cbs,경산시청,,,"[('즉시 보건소로 상담바랍니다', 0.6715)]"
2020/04/14 14:48:54,75,경상북도 경산시,33407,"발열, 호흡기 증상, 미각, 후각에 이상을 느끼시는 분은 즉시 보건소(810-6641~2)로 상담 바라며, 내일 투표소 갈 때 마스크를 꼭 착용하세요.",cbs,경산시청,810-6641~2,,"[('증상 미각 후각에 이상을', 0.6698)]"
2020/04/13 09:02:22,75,경상북도 경산시,33297,"지난주는 특히 사람 간 접촉이 많았으므로 발열, 기침, 인후통 등 증상 시 외출과 출근 자제하시고 반드시 보건소(810-6641~2)로 상담바랍니다.",cbs,경산시청,810-6641~2,,"[('특히 사람 접촉이', 0.5811)]"
2020/04/12 11:03:48,75,경상북도 경산시,33252,"코로나19와의 전쟁은 계속 중, 사회적 거리두기 아직 멈출 때가 아닙니다. 다시한번 경산시민의 힘을 모읍시다.",cbs,경산시청,,,"[('아직 멈출', 0.5656)]"
