2020/06/10 15:27:16,144,서울특별시 금천구,37442,"수도권내 감염자 지속 발생, 기침 예절과 손씻기의 생활화, 밀폐·밀집·밀접 시설 방문 및 모임 자제, 집합판매장소 등 출입을 자제하여 주시기 바랍니다.",cbs,금천구청,,,"[('자제하여 주시기', 0.6538)]"
2020/06/10 11:31:07,144,서울특별시 금천구,37421,"20번째(독산4동), 21번째 확진자(독산3동) 발생, 역학조사 후 동선공개, 소규모 모임 및 종교 활동, 집합판매장소 출입 자제, 비대면 모임 권고",cbs,금천구청,독산4동,,"[('소규모 모임 종교 활동', 0.5064)]"
2020/06/09 15:36:23,144,서울특별시 금천구,37369,"19번째 확진자(독산4동, 69세, 남성) 발생, 서남병원 이송 즉시 자택방역 예정, 역학조사 후 동선 공개, 마스크 착용, 개인위생 철저",cbs,금천구청,"독산4동, 69세, 남성",69세,"[('마스크 착용 개인위생 철저', 0.621)]"
2020/06/03 13:30:00,144,서울특별시 금천구,36930,"17번째 확진자(독산1동, 5.27부터 자가격리), 18번째 확진자(가산동, 5.28부터 자가격리) 발생, 역학조사 후 동선공개, 개인 위생수칙 준수",cbs,금천구청,"독산1동, 5.27부터 자가격리",,"[('동선공개 개인 위생수칙', 0.5887)]"
2020/06/02 13:17:35,144,서울특별시 금천구,36859,"16번째 확진자(독산4동, 47세, 여성) 발생, 서남병원 이송 즉시 자택방역 예정, 역학조사 후 동선 공개, 마스크 착용, 개인위생 철저",cbs,금천구청,"독산4동, 47세, 여성",47세,"[('이송 즉시 자택방역 예정', 0.6288)]"
2020/05/28 14:05:29,144,서울특별시 금천구,36452,"15번째 확진자(시흥2동, 52세, 여성) 발생, 5.24.부터 자가격리중, 동거가족 6명 자가격리 조치, 금일 코로나19 검사 및 자택방역 예정",cbs,금천구청,"시흥2동, 52세, 여성",52세,"[('검사 자택방역 예정', 0.6592)]"
2020/05/26 11:42:42,144,서울특별시 금천구,36280,"14번째 확진자(독산4동, 63세, 남성, 동거가족 없음) 발생, 국가지정병원 이송 준비중, 이송 즉시 자택 방역소독, 역학조사 후 동선 공개",cbs,금천구청,"독산4동, 63세, 남성, 동거가족 없음",63세,"[('확진자 독산4동 63세 남성', 0.6871)]"
2020/05/15 18:18:49,144,서울특별시 금천구,35491,"13번째 확진자 동선 2차 공개, 자세한 내용 홈페이지 및 SNS 확인 blog.naver.com/geumcheon1",cbs,금천구청,,,"[('13번째 확진자 동선', 0.4098)]"
2020/05/14 19:25:15,144,서울특별시 금천구,35392,"13번째 확진자 동선 1차 공개(확진자 진술), 자세한 내용 홈페이지 및 SNS 확인 blog.naver.com/geumcheon1",cbs,금천구청,확진자 진술,,"[('공개 확진자 진술', 0.5055)]"
2020/05/14 11:03:10,144,서울특별시 금천구,35342,"13번째 확진자(시흥1동, 20세, 남성) 발생, 국가지정병원 이송 준비중, 이송 즉시 자택 방역소독, 역학조사 후 동선 공개",cbs,금천구청,"시흥1동, 20세, 남성",20세,"[('즉시 자택 방역소독 역학조사', 0.6852)]"
2020/05/09 18:04:06,144,서울특별시 금천구,34803,"4.24 ~ 5.6까지 이태원 인근 클럽 등 업소방문자는 증상유무 관계없이 2주간 외출·접촉자제, 보건소를 방문하여 코로나19 검사 받으시기 바람",cbs,금천구청,,,"[('6까지 이태원 인근 클럽', 0.5303)]"
2020/04/29 17:23:38,144,서울특별시 금천구,34234,"황금연휴를 슬기롭게 보내는 방법, 사회적 거리두기 실천은 세상에서 가장 강력한 치료약입니다. 조금 불편하더라도 조금 답답하더라도 끝까지 동참해 주세요",cbs,금천구청,,,"[('조금 답답하더라도 끝까지 동참해', 0.7187)]"
2020/04/10 21:48:06,144,서울특별시 금천구,33133,"사회적 거리두기 2주(~4.19.) 연장, 주말 외출 및 실내 밀폐시설 방문 자제, 사회적 거리두기는 나와 가족을 지키는 강력한 방역 수단입니다.",cbs,금천구청,~4.19.,,"[('가족을 지키는', 0.7322)]"
2020/04/04 12:55:23,144,서울특별시 금천구,32593,"주말 봄꽃축제 및 모임 자제, 종교행사, 실내 체육시설 등 집단감염 위험이 높은 시설 이용 자제, ‘강력한 사회적 거리두기’ 에 동참 바랍니다.",cbs,금천구청,,,"[('봄꽃축제 모임 자제', 0.6877)]"
2020/03/30 21:11:27,144,서울특별시 금천구,31963,"9~12번째 확진자 추가 동선 공개, 자세한 내용 홈페이지 및SNS(blog.naver.com/geumcheon1) 확인",cbs,금천구청,blog.naver.com/geumcheon1,,"[('동선 공개 자세한 내용', 0.409)]"
2020/03/29 19:33:39,144,서울특별시 금천구,31859,"9~12번째 확진자 1차 동선 공개(본인진술), 자세한 내용 홈페이지(https://www.geumcheon.go.kr) 및 SNS 확인",cbs,금천구청,본인진술,,"[('1차 동선 공개', 0.4705)]"
2020/03/29 12:46:07,144,서울특별시 금천구,31806,"9,10,11,12번째 확진자(독산4동,가족,만민중앙교회 신도) 발생, 국가지정병원 이송 준비중, 이송 즉시 자택 방역소독, 역학조사 후 동선 공개",cbs,금천구청,"독산4동,가족,만민중앙교회 신도",,"[('준비중 이송', 0.5178)]"
2020/03/27 23:22:46,144,서울특별시 금천구,31574,"8번째 확진자(독산3동, 남, 55세, 6번째 확진자의 접촉자) 동선 공개, 자세한 내용은 홈페이지 및 SNS 확인",cbs,금천구청,"독산3동, 남, 55세, 6번째 확진자의 접촉자",55세,"[('확진자의 접촉자 동선 공개', 0.628)]"
2020/03/27 21:44:05,144,서울특별시 금천구,31570,"7번째 확진자(독산1동, 여, 33세, 가산동 SK트윈타워 직장인, 6번째 확진자의 배우자) 동선 공개, 자세한 내용은 홈페이지 및 SNS 확인",cbs,금천구청,"독산1동, 여, 33세, 가산동 SK트윈타워 직장인, 6번째 확진자의 배우자",33세,"[('sk트윈타워 직장인', 0.6321)]"
2020/03/27 15:45:34,144,서울특별시 금천구,31498,"8번째 확진자(독산3동,남,55세,구로 만민중앙교회) 발생, 보라매병원 이송, 거주지 방역소독 실시, 역학조사 후 동선 공개",cbs,금천구청,"독산3동,남,55세,구로 만민중앙교회",55세,"[('거주지 방역소독 실시', 0.6554)]"
2020/03/26 19:44:38,144,서울특별시 금천구,31418,"6번째 확진자(독산1동, 남, 40세) 동선 1차 공개, 역학조사가 완료되는 대로 신속히 재안내 예정, 자세한 내용은 홈페이지 및 SNS 확인",cbs,금천구청,"독산1동, 남, 40세",40세,"[('자세한 내용은 홈페이지 sns', 0.5939)]"
2020/03/26 09:25:42,144,서울특별시 금천구,31326,"7번째 확진자(6번째 확진자의 배우자,독산1동,여,33세) 발생, 국가지정병원 이송 준비중, 자택 방역소독 완료, 역학조사 후 홈페이지 동선 공개 예정",cbs,금천구청,"6번째 확진자의 배우자,독산1동,여,33세",33세,"[('이송 준비중', 0.6344)]"
2020/03/25 10:52:26,144,서울특별시 금천구,31218,"6번째 확진자(독산1동, 남, 40세) 발생, 보라매병원으로 이송 준비중, 이송 후 방역실시 예정, 확진자 동선은 역학조사 후 홈페이지 공개 예정",cbs,금천구청,"독산1동, 남, 40세",40세,"[('동선은 역학조사 홈페이지', 0.643)]"
2020/03/13 18:01:20,144,서울특별시 금천구,29874,"5번째 확진자(독산1동) 동선공개, 3.9 자택 및 용인시 방문(자차), 3.10 외부활동(독산1동), 3.11 금천구 선별진료소 검사, 홈페이지 참조",cbs,금천구청,독산1동,,"[('자택 용인시', 0.5988)]"
2020/03/13 16:34:42,144,서울특별시 금천구,29864,"4번째 확진자(3번째 확진자 가족) 동선 공개, 3.10 자택, 3.11 금천구 선별진료소 방문(도보) 후 자택 귀가(도보), 홈페이지 참조",cbs,금천구청,3번째 확진자 가족,,"[('가족 동선', 0.6694)]"
2020/03/12 15:03:55,144,서울특별시 금천구,29747,"4번째 확진자(시흥1동, 남, 3번째 확진자 가족), 5번째 확진자(독산1동, 남, 관악구 소재 회사동료 확진자 접촉) 발생, 국가지정병원 이송 준비중",cbs,금천구청,"시흥1동, 남, 3번째 확진자 가족",,"[('5번째 확진자 독산1동 관악구', 0.7695)]"
2020/03/11 18:09:38,144,서울특별시 금천구,29665,"3번째 확진자(시흥1동, 구로구 콜센터 직원) 역학조사 결과 접촉자 가족 1명, 자가격리 중, 자택 방역소독 완료",cbs,금천구청,"시흥1동, 구로구 콜센터 직원",,"[('콜센터 직원 역학조사 결과', 0.7015)]"
2020/03/11 17:57:09,144,서울특별시 금천구,29662,"금천구 2번째 확진자(가산동, 구로구 콜센터 직원) 역학조사 결과 접촉자 1명, 현재 증상은 없으나 자가격리 중, 방문 장소 방역소독 완료",cbs,금천구청,"가산동, 구로구 콜센터 직원",,"[('결과 접촉자 1명', 0.7518)]"
2020/03/10 17:16:07,144,서울특별시 금천구,29505,"금천구 3번째 확진자(시흥1동, 여성, 구로구 콜센터 직원) 발생, 국가지정병원 이송 준비 중, 추후 확진자 동선 및 구체적인 사항은 홈페이지 안내",cbs,금천구청,"시흥1동, 여성, 구로구 콜센터 직원",,"[('동선 구체적인', 0.7052)]"
2020/03/10 00:05:50,144,서울특별시 금천구,29411,"구로구 확진자(구로5동, 남성) 금천01번 운수종사자, 차량방역 실시, 3.10 첫차부터 예비차량 투입, 벽산아파트~금천구청역까지만 단축운행",cbs,금천구청,"구로5동, 남성",,"[('구로5동 남성 금천01번', 0.7008)]"
2020/03/10 00:02:38,144,서울특별시 금천구,29410,"금천구 2번째 확진자(가산동, 여성) 발생, 서울의료원 이송, 긴급방역 실시, 상세 정보는 추후 홈페이지 참조",cbs,금천구청,"가산동, 여성",,"[('실시 상세 정보는 추후', 0.7102)]"
2020/03/07 13:41:09,144,서울특별시 금천구,29077,"코로나19 확산 방지를 위해 예배, 법회, 미사 등 종교행사와 각종 모임 참석을 자제하여 주시고, 사회적 거리두기 실천 등 예방수칙 준수 요망",cbs,금천구청,,,"[('주시고 사회적 거리두기 실천', 0.7585)]"
2020/03/03 17:33:39,144,서울특별시 금천구,28396,"금천구 확진자(74세, 중국인 여성) 금일 격리해제(퇴원), 영등포구 확진자와의 접촉자 7명(자세한 사항 홈페이지 참고), 금천구민 없음",cbs,금천구청,"74세, 중국인 여성",74세,"[('접촉자 7명 자세한 사항', 0.675)]"
2020/03/02 15:55:49,144,서울특별시 금천구,28126,"광명시 확진자와의 접촉자 4명(가산동 에이스하이엔드타워9차 직장인), 금천구 주민 없음, 출근시간대 건물입구에서 발열여부 확인, 현재 유증상자 없음",cbs,금천구청,가산동 에이스하이엔드타워9차 직장인,,"[('현재 유증상자 없음', 0.6454)]"
2020/03/01 16:36:14,144,서울특별시 금천구,27918,"16시 현재 금천구 추가 확진자 없음, 영등포 확진자 동선 방역소독 완료(가산동 에이스하이엔드타워9차), 개인 위생관리와 예방수칙 준수, 홈페이지 참고",cbs,금천구청,가산동 에이스하이엔드타워9차,,"[('방역소독 완료 가산동 에이스하이엔드타워9차', 0.6535)]"
2020/02/27 16:59:05,144,서울특별시 금천구,27015,"확진자와 접촉한 7명 모두 음성 판정, 현재 자가격리중, 격리기간 종료 전 재검사하여 음성판정시 격리해제, 관련 장소 모두 방역소독 완료",cbs,금천구청,,,"[('모두 음성 판정 현재', 0.701)]"
2020/02/27 11:55:44,144,서울특별시 금천구,26904,"코로나19 확진자(74세, 여) 이동경로 안내. 방역 모두 완료. 금천구청 홈페이지를 참고해 주시기 바랍니다.",cbs,금천구청,"74세, 여",74세,"[('확진자 74세', 0.5241)]"
2017/06/11 14:01:22,144,서울특별시 금천구,2476,"정전안내. 영서변전소 기능문제로 오늘 12:53부터 금천구 전역 정전발생, 피해사항은 2680-2999로 신고바랍니다.",cbs,금천구청,,,"[('53부터 금천구', 0.4383)]"
