create_date,location_id,location_name,md101_sn,msg,send_platform,cast,missing,age,keyword
2021/02/14 21:54:57,206,전라북도 남원시,91892,남원시 인월면 소재 협동이용원(인월신촌길 8-8)을 2.11.(목) 방문하신 분은 2.15.(월) 보건소 선별진료소 방문검사 바랍니다.,cbs,남원시2,인월신촌길 8-8,,"[('15 보건소', 0.5015)]"
2020/12/04 13:46:29,206,전라북도 남원시,69998,"도내 코로나19 확진자가 급증하고있으니 소모임,행사참여로인한 외출을 자제하여 주시고, 발열등 호흡기 증상이 있는분은 선별진료소에서 검사하시기 바랍니다.",cbs,남원시2,,,"[('주시고 발열등', 0.6466)]"
2020/10/19 17:02:27,206,전라북도 남원시,61836,위탁 병의원은 동별 날짜 제한없이 원하시는 날짜에 독감접종 가능합니다. 가까운 집근처 병의원을 이용하시길 권장합니다.,cbs,남원시2,,,"[('원하시는 날짜에', 0.6112)]"
2020/10/16 15:52:02,206,전라북도 남원시,61608,보건소는 동별로 접종 실시. ▲20일 동충동 ▲21일 죽항동 ▲22일 노암동 ▲23일 금동 ▲26일 왕정동 ▲27~28일 향교동 ▲29~30일 도통동,cbs,남원시2,,,"[('노암동 23일 금동 26일', 0.6602)]"
2020/08/22 19:36:54,206,전라북도 남원시,48075,"남원시민 여러분, 이번주말이 코로나확산의 중대한 기로입니다. 타지역방문및 대면종교활동을 멈춰줄것을 간곡히 호소합니다. 내가족과 이웃을 지킬수 있습니다.",cbs,남원시2,,,"[('이번주말이 코로나확산의', 0.7136)]"
2020/08/21 14:40:55,206,전라북도 남원시,47315,"계도기간(10월18일)후 위반시에 과태료(10만원)부과됩니다. 또한 종교,소모임활동, 수도권방문을 자제하여주시기 바랍니다.(063-625-1339)",cbs,남원시2,10월18일,,"[('부과됩니다 또한 종교 소모임활동', 0.5259)]"
2020/07/02 17:28:05,206,전라북도 남원시,39336,"라페스타웨딩홀 2층 뷔페식당 6.28(일) 13:30~14:30, 데일리컨벤션(마륵동) 3층 비스타홀 6.26(금) 19:00~21:00",cbs,남원시2,일,,"[('라페스타웨딩홀 2층 뷔페식당', 0.5586)]"
2020/05/10 15:37:24,206,전라북도 남원시,34866,신용카드 신청보다 다소 불편하지만 읍면동 방문신청하여 주시기 바랍니다.,cbs,남원시2,,,"[('주시기 바랍니다', 0.3315)]"
2020/03/25 11:43:07,206,전라북도 남원시,31231,"유흥주점,노인요양병원(보건소)/학원(교육지원청,교육체육과)/노인요양시설,노인요양시설공동생활가정(여성가족과) 그 외 업종 해당없음",cbs,남원시2,보건소,,"[('유흥주점 노인요양병원 보건소', 0.5561)]"
