2023/07/14 10:06:46,82,경상북도 봉화군,197351,"오전저수지 만수위에 따른 월류로 추가 강우 시 침수 위험이 높아, 오전저수지 하류 주민들께서는 마을회관, 경로당 등으로 사전대피 하여 주시기 바랍니다.",cbs,봉화군,,,"[('하류 주민들께서는 마을회관 경로당', 0.7482)]"
2023/07/14 08:57:48,"10516,10517,10518,10520,10521,10525","경상북도 봉화군,경상북도 봉화군,경상북도 봉화군,경상북도 봉화군,경상북도 봉화군,경상북도 봉화군",197324,"오늘 봉화,물야,봉성,춘양,소천,석포 지역에 많은 비로 산사태 주의보 발령. 산림 주변 야외활동 자제와 입산금지 등 안전에 유의하시기 바랍니다.",cbs,봉화군,,,"[('비로 산사태 주의보', 0.6038)]"
2023/07/14 06:18:38,82,경상북도 봉화군,197264,"호우경보 발효중, 강한 비가 이어질 전망으로, 외출을 자제하시고 산사태, 급경사지, 하천변 등 위험지역 접근을 자제하시기 바라며 안전에 유의 바랍니다.",cbs,봉화군,,,"[('산사태 급경사지 하천변 위험지역', 0.7228)]"
2023/07/13 12:34:20,82,경상북도 봉화군,197070,"현재 많은 비가오는 가운데 당분간 강한비가 이어질 전망으로 ,외출을 자제하시고 산사태, 급경사지, 하천변 등 위험지역 접근을 반드시 금지하시기 바랍니다.",cbs,봉화군,,,"[('급경사지 하천변', 0.6785)]"
2023/07/13 08:52:37,82,경상북도 봉화군,196974,"주말까지 많은 비가 예상되니, 강우시 외출을 자제하시고,내린 비로 지반이 약해져 있어 축대 옹벽 및 산사태가 우려되니 위험지역 접근을 자제하시기바랍니다.",cbs,봉화군,,,"[('자제하시고 내린', 0.7504)]"
2023/07/12 11:22:25,82,경상북도 봉화군,196930,"당분간 많은 비가 예상되니, 강우시 외출을 자제하시고,내린 비로 지반이 약해져 있어 축대 옹벽 및 산사태가 우려되니 위험지역 접근을 자제하시기 바랍니다.",cbs,봉화군,,,"[('내린 비로 지반이 약해져', 0.7594)]"
2023/07/11 14:04:14,82,경상북도 봉화군,196795,"많은 비가 예보되어, 선제적 대응을 위해 내성천둔치주차장을 오늘 18시 이후 통제하오니, 차량 이동 조치 및 하천변 출입을 금하여 주시기 바랍니다.",cbs,봉화군,,,"[('하천변 출입을', 0.6981)]"
2023/07/10 07:42:28,82,경상북도 봉화군,196710,"많은 비가 예상되오니 산사태, 하천변, 급경사지 등 취약지역 주민들께서는 사전대비 및 안전에 유의하시기 바라며, 접근 또한 금지하여 주시기 바랍니다.",cbs,봉화군,,,"[('취약지역 주민들께서는 사전대비 안전에', 0.7508)]"
2023/07/07 14:51:05,82,경상북도 봉화군,196563,"많은 선행 강우가 내린 가운데, 오늘 오후부터 밤까지 강한 비가 예상되니 산지, 하천변, 급경사지 등 위험지역 출입을 자제하여 주시기 바랍니다.",cbs,봉화군,,,"[('하천변 급경사지 위험지역', 0.7182)]"
2023/06/29 23:18:59,82,경상북도 봉화군,196196,"오늘 23시 봉화군 전지역 호우경보. 저지대, 침수 우려지역 등 위험지역에서는 가족, 이웃과 정보를 공유하고 안전한 곳으로 대피하시기 바랍니다",cbs,봉화군,,,"[('호우경보 저지대 침수 우려지역', 0.6398)]"
2023/04/03 16:47:53,82,경상북도 봉화군,194106,오늘 14시 15분 영주시 박달산 산불 발생 확산 중. 예고개 원천 구간 양방향 전면 통제중. 인근 주민들은 우회 부탁드립니다.,cbs,봉화군,,,"[('영주시 박달산 산불', 0.6451)]"
2017/05/19 13:32:50,82,경상북도 봉화군,2380,"오늘 현재 석포 면사무소 뒤 산불 발생, 인근 마을 주민들은 위험이 예상되니 안전한 지역으로 대피바랍니다.",cbs,봉화군,,,"[('현재 석포 면사무소 산불', 0.6831)]"
