create_date,location_id,location_name,md101_sn,msg,send_platform,cast,missing,age,keyword
2023/07/23 14:56:56,"9176,9194,9213","경기도 용인시 처인구,경기도 용인시 기흥구,경기도 용인시 수지구",199521,"7월 22일부터 계속되는 호우로 인하여 지반이 약해져 수목 전도, 낙석 등 위험이 있으니 보행 및 차량주차시 주의하여 주시기 바랍니다.",cbs,용인시,,,"[('수목 전도 낙석 위험이', 0.5669)]"
2023/07/23 09:33:49,"9176,9194,9213","경기도 용인시 처인구,경기도 용인시 기흥구,경기도 용인시 수지구",199456,"현재 호우주의보 발효로 오전 중 많은 비가 예상되오니 하천변 산책로, 산사태위험지역, 상습침수지역 등 위험지역 접근을 금지하여 주시기 바랍니다.",cbs,용인시,,,"[('접근을 금지하여', 0.7485)]"
2023/07/22 21:12:33,"9176,9194,9213","경기도 용인시 처인구,경기도 용인시 기흥구,경기도 용인시 수지구",199397,오늘부터 많은 비가 내릴것으로 예보되어 있습니다. 관내 하천변 산책로를 통제하오니 하천내 출입을 금하여 주시기 바랍니다.,cbs,용인시,,,"[('오늘부터 많은 비가', 0.692)]"
2023/07/21 18:10:14,"9176,9194,9213","경기도 용인시 처인구,경기도 용인시 기흥구,경기도 용인시 수지구",199151,대만발송 유해물질로 의심되는 해외 우편물을 수령하였을 경우 개봉하지 말고 즉시 112 또는 119로 신고하여 주시기 바랍니다.,cbs,용인시,,,"[('신고하여 주시기', 0.6475)]"
2023/07/21 14:14:28,"9176,9194,9213","경기도 용인시 처인구,경기도 용인시 기흥구,경기도 용인시 수지구",199107,폭염주의보 발효에 따라 야외활동을 자제하여 주시고 충분한 휴식과 수분섭취로 건강 및 안전관리에 유의 바랍니다.,cbs,용인시,,,"[('폭염주의보 발효에 따라 야외활동을', 0.7345)]"
2023/07/18 10:30:21,"9176,9194,9213","경기도 용인시 처인구,경기도 용인시 기흥구,경기도 용인시 수지구",198590,"현재 호우경보 발효중, 많은 비가 예상되오니 상습침수지역, 하천변 산책로, 산사태위험지역 등 위험지역 접근을 금지하여 주시기 바랍니다.",cbs,용인시,,,"[('산책로 산사태위험지역 위험지역 접근을', 0.7772)]"
2023/07/17 22:54:20,"9176,9194,9213","경기도 용인시 처인구,경기도 용인시 기흥구,경기도 용인시 수지구",198521,"현재 호우주의보 발효중, 많은 비가 예상되오니 상습침수지역, 하천변 산책로, 산사태위험지역 등 위험지역 접근을 금지하여 주시기 바랍니다.",cbs,용인시,,,"[('산사태위험지역 위험지역 접근을 금지하여', 0.7542)]"
2023/07/17 22:08:54,"9176,9194,9213","경기도 용인시 처인구,경기도 용인시 기흥구,경기도 용인시 수지구",198514,20시 30분 호우주의보 발효에 따라 상습침수도로를 22시 10분에 차단하오니 도로이용객은 우회하시기 바랍니다.,cbs,용인시,,,"[('따라 상습침수도로를', 0.6295)]"
2023/07/17 21:09:58,"9176,9194,9213","경기도 용인시 처인구,경기도 용인시 기흥구,경기도 용인시 수지구",198498,"20:30 호우주의보 발효에 따라 하천변, 계곡 등 위험지역 방문을 자제하여 주시고, 반지하, 저지대, 침수 우려지역 등은 안전에 유의 바랍니다.",cbs,용인시,,,"[('안전에 유의 바랍니다', 0.6185)]"
2023/07/16 10:48:55,"9176,9194,9213","경기도 용인시 처인구,경기도 용인시 기흥구,경기도 용인시 수지구",198203,13일부터 비가 많이 내려 산사태가 우려됩니다. 19일까지 비가 예상되오니 산과 인접해 거주하시는 시민은 친인척 집 등 안전한 곳으로 대피하시기 바랍니다,cbs,용인시,,,"[('친인척 안전한', 0.5929)]"
2023/07/15 21:21:16,"9176,9194,9213","경기도 용인시 처인구,경기도 용인시 기흥구,경기도 용인시 수지구",198091,"15일 저녁부터 16일까지 시간당 30~60mm 호우가 예상되오니 하천산책로, 세월교 등 침수위험지역에는 접근하지 마시길 바랍니다.",cbs,용인시,,,"[('예상되오니 하천산책로 세월교 침수위험지역에는', 0.4739)]"
2023/07/15 18:14:23,"9176,9194,9213","경기도 용인시 처인구,경기도 용인시 기흥구,경기도 용인시 수지구",197987,"7월15일 저녁부터 16일까지 시간당 30~60mm 비가 예상되오니 산사태 위험지역, 비탈면 급경사지 등 붕괴우려지역에는 접근하지 마시길 바랍니다.",cbs,용인시,,,"[('급경사지 붕괴우려지역에는 접근하지 마시길', 0.4679)]"
2023/07/15 11:27:39,"9176,9194,9213","경기도 용인시 처인구,경기도 용인시 기흥구,경기도 용인시 수지구",197838,"7.13.부터 내린 비로 인하여 지반이 약해져 있어 산사태, 낙석, 옹벽 및 축대 붕괴가 우려되오니 재난 취약지역은 접근하지 마시길 바랍니다.",cbs,용인시,,,"[('인하여 지반이', 0.5831)]"
2023/07/14 21:34:36,"9176,9194,9213","경기도 용인시 처인구,경기도 용인시 기흥구,경기도 용인시 수지구",197603,오늘 우리 지역에 많은 비로 산사태 주의보가 발령되었습니다. 산림 주변 야외활동 자제와 입산금지 등 안전에 유의하시기 바랍니다.,cbs,용인시,,,"[('발령되었습니다 산림 주변', 0.6456)]"
2023/07/14 20:08:43,"9176,9194,9213","경기도 용인시 처인구,경기도 용인시 기흥구,경기도 용인시 수지구",197571,"반지하주택, 지하상가 등 바닥에 물이 차오르거나 하수 역류시 즉시 지상으로 대피해주세요. 공동주택 지하주차장은 빗물 유입시 출입을 금지해주세요.",cbs,용인시,,,"[('반지하주택 지하상가', 0.7446)]"
2023/07/13 22:56:49,"9176,9194,9213","경기도 용인시 처인구,경기도 용인시 기흥구,경기도 용인시 수지구",197201,"21:00 호우경보 발효에 따라 하천변, 계곡 등 위험지역 방문을 자제하여 주시고, 반지하, 저지대, 침수 우려지역 등은 안전에 유의 바랍니다.",cbs,용인시,,,"[('침수 우려지역 등은', 0.6853)]"
2023/07/13 12:11:56,"9176,9194,9213","경기도 용인시 처인구,경기도 용인시 기흥구,경기도 용인시 수지구",197063,"오늘 10시 30분 호우주의보 발효. 하천변 산책로, 침수 우려지역 등 위험지역에서는 가족, 이웃과 정보를 공유하고 안전한 곳으로 대피하시기 바랍니다.",cbs,용인시,,,"[('침수 우려지역 위험지역에서는 가족', 0.6913)]"
2023/07/13 07:02:45,"9176,9194,9213","경기도 용인시 처인구,경기도 용인시 기흥구,경기도 용인시 수지구",196964,"7월13일부터 14일까지 최대 250mm이상 많은 비가 예상됩니다. 외출자제 및 하천변 산책로, 급경사지 등 위험지역 접근을 금지하여 주시기 바랍니다.",cbs,용인시,,,"[('접근을 금지하여 주시기', 0.3854)]"
2023/07/12 20:41:04,"9176,9194,9213","경기도 용인시 처인구,경기도 용인시 기흥구,경기도 용인시 수지구",196957,"7월13일부터 용인지역에 많은 비가 예상됩니다. 외출자제 및 하천변 산책로, 급경사지 등 위험지역 접근을 금지해 주시기 바라며 대중교통을 이용바랍니다.",cbs,용인시,,,"[('주시기 바라며 대중교통을', 0.6639)]"
2023/07/08 11:24:02,"9176,9194,9213","경기도 용인시 처인구,경기도 용인시 기흥구,경기도 용인시 수지구",196615,폭염주의보 발효에 따라 야외활동을 자제하여 주시고 충분한 휴식과 수분섭취로 건강 및 안전관리에 유의 바랍니다.,cbs,용인시,,,"[('폭염주의보 발효에 따라 야외활동을', 0.7345)]"
2023/07/06 11:15:15,"9176,9194,9213","경기도 용인시 처인구,경기도 용인시 기흥구,경기도 용인시 수지구",196526,"폭염주의보 발효에 따라 야외활동 자제, 충분한 물 마시기, 가벼운 옷차림, 양산지니기 등 건강에 유의바랍니다.",cbs,용인시,,,"[('옷차림 양산지니기 건강에', 0.623)]"
2023/07/03 13:21:41,"9176,9194,9213","경기도 용인시 처인구,경기도 용인시 기흥구,경기도 용인시 수지구",196379,"폭염주의보 발효에 따라 야외활동 자제, 충분한 물 마시기, 가벼운 옷차림, 양산지니기 등 건강에 유의바랍니다.",cbs,용인시,,,"[('옷차림 양산지니기 건강에', 0.623)]"
2023/07/01 11:42:38,"9176,9194,9213","경기도 용인시 처인구,경기도 용인시 기흥구,경기도 용인시 수지구",196274,"폭염주의보 발효중으로 농사일 및 옥외 작업현장에서는 충분한 수분 섭취와 휴식, 주변 노약자분들께는 안부전화등 건강관리에 유의바랍니다.",cbs,용인시,,,"[('폭염주의보 발효중으로 농사일', 0.7234)]"
2021/06/02 17:37:07,44,경기도 용인시,107981,"5월15일,17일,20일 낙원사우나(김량장동 소재)여탕방문자 중 유증상자는 가까운 선별진료소에서 코로나19검사를 받으시기 바랍니다.",cbs,용인시,김량장동 소재,,"[('17일 20일', 0.5106)]"
2020/02/24 07:00:35,44,경기도 용인시,25940,"코로나19 확진자 1명 발생, 집회 및 행사 등 참석 금지, 개인위생 철저, 의심증상 발생시 1339, 031-120, 1577-1122로 연락바랍니다.",cbs,용인시,,,"[('확진자 1명 발생', 0.5896)]"
2020/02/22 12:30:05,44,경기도 용인시,25647,"최근 대구, 경북지역, 신천지 대구교회 방문하신 분 중 발열, 호흡기 증상 발생하신 분은 1339, 031-120, 1577-1122로 연락바랍니다.",cbs,용인시,,,"[('발열 호흡기 증상', 0.6568)]"
2020/02/01 11:30:25,44,경기도 용인시,25141,"신종 코로나바이러스 확진환자가 없으니 안심바랍니다. 예방수칙(손씻기 등)을 준수하시고 의심시 1339, 120, 1577-1122로 상담바랍니다.",cbs,용인시,손씻기 등,,"[('확진환자가 없으니', 0.5241)]"
