create_date,location_id,location_name,md101_sn,msg,send_platform,cast,missing,age,keyword
2022/11/30 10:04:55,162,울산광역시 전체,183049,"중증예방을 위해 60세 이상은 동절기 코로나19 추가접종에 적극 참여해주세요. ▲최종 접종일로부터 90일 후 가능 ☎1339,052-120,보건소",cbs,울산광역시청,,60세,"[('추가접종에 적극', 0.5972)]"
2022/07/22 09:59:15,162,울산광역시 전체,164515,"7.22. 0시기준 코로나19확진 1,871명(중구297 남구501 동구319 북구386 울주368)손씻기등 일상에서 자율적인 방역수칙 준수바랍니다",cbs,울산광역시청,중구297 남구501 동구319 북구386 울주368,,"[('동구319 북구386 울주368 손씻기등', 0.5618)]"
2022/06/30 10:00:08,162,울산광역시 전체,161760,6.30. 0시기준 코로나19확진 281명(중구53 남구80 동구42 북구58 울주48) 60세 이상 중증예방을 위해 4차접종 적극 참여 바랍니다,cbs,울산광역시청,중구53 남구80 동구42 북구58 울주48,60세,"[('4차접종 적극 참여 바랍니다', 0.6213)]"
2021/07/26 14:05:16,162,울산광역시 전체,114585,"사회적 거리두기 3단계(7. 27.~ 8. 8.) 사적모임 4인까지, 유흥시설, 식당·카페 등 영업시간 22시까지, 마스크 착용을 생활화 합시다.",cbs,울산광역시청,7. 27.~ 8. 8.,,"[('유흥시설 식당 카페', 0.5925)]"
2021/07/23 16:11:51,162,울산광역시 전체,114147,"임시선별검사소 ▲문수경기장(평일 9~20시,주말 9~17시)▲종합운동장(평일,주말 9~17시)▲동구국민체육센터,농소운동장(평일 9~17시)입니다.",cbs,울산광역시청,"평일 9~20시,주말 9~17시",,"[('농소운동장 평일', 0.4493)]"
2021/01/14 19:20:54,162,울산광역시 전체,84240,코로나19 858번(남구) 확진자 발생. 역학조사 중입니다.,cbs,울산광역시청,남구,,"[('확진자 발생 역학조사', 0.5497)]"
2020/09/03 06:32:35,162,울산광역시 전체,53383,태풍 마이삭 영향으로 울산지역에 정전이 다수 발생하여 교통신호등의 작동이 원활하지 않습니다. 출근길 안전운전에 유의하시기 바랍니다.,cbs,울산광역시청,,,"[('영향으로 울산지역에 정전이 다수', 0.7962)]"
2020/07/22 06:59:56,162,울산광역시 전체,41078,"금일 5시 30분 호우주의보 발효에 따라 많은 비가 내리고 있으니, 출근길에 안전운행 하시기 바랍니다.",cbs,울산광역시청,,,"[('5시 30분', 0.6712)]"
2020/02/23 19:44:53,162,울산광역시 전체,25917,"코로나19확진자 동선, 울산시홈페이지에 게시. 접촉의심 및 호흡기 증상발생시 병원가기전 선별진료소 우선방문,1339 또는 관할보건소로 상담바랍니다.",cbs,울산광역시청,,,"[('게시 접촉의심 호흡기 증상발생시', 0.5183)]"
2020/02/21 11:13:22,162,울산광역시 전체,25497,"코로나19 예방수칙(손씻기, 마스크착용 등) 생활화. 병원면회 자제. 감염증 의심시 1339 또는 보건소 문의 후, 선별진료소를 우선 방문하십시오",cbs,울산광역시청,"손씻기, 마스크착용 등",,"[('보건소 문의 선별진료소를', 0.6212)]"
2020/02/19 13:57:37,162,울산광역시 전체,25422,"대구경북지역 확진자 발생. 지역전파 차단을 위해 예방수칙(손씻기, 마스트착용 등) 준수. 코로나19 증상 발현시 1339 또는 보건소로 상담바랍니다",cbs,울산광역시청,"손씻기, 마스트착용 등",,"[('손씻기 마스트착용', 0.6034)]"
2020/02/05 18:04:58,162,울산광역시 전체,25254,신종 코로나바이러스 예방을 위해 손씻기 등 예방수칙 준수. 중국 방문 후 감염증 의심시 의료기관 방문 전 1339콜센터 또는 보건소로 상담바랍니다.,cbs,울산광역시청,,,"[('의료기관 방문', 0.674)]"
2020/01/27 13:58:40,162,울산광역시 전체,25043,"신종 코로나바이러스감염증 예방수칙(손씻기 등) 준수, 중국 우한시 여행후 14일 이내 발열, 호흡기 증상 시 1339 또는 보건소로 상담바랍니다.",cbs,울산광역시청,손씻기 등,,"[('신종 코로나바이러스감염증', 0.5985)]"
2019/10/12 18:10:54,162,울산광역시 전체,24877,강풍으로 인한 피해가 발생되지 않도록 시설물 관리 및 안전사고에 유의하시고 외출 자제 바랍니다. (229-4641~7),cbs,울산광역시청,229-4641~7,,"[('발생되지 않도록 시설물 관리', 0.5894)]"
2019/09/29 14:33:22,162,울산광역시 전체,24763,선박화재로 인한 울산대교 안전점검 결과 이상이 없어 14시 30분부로 교통통제 해제를 알려드립니다.,cbs,울산광역시청,,,"[('30분부로 교통통제', 0.5935)]"
2019/09/29 11:46:16,162,울산광역시 전체,24760,금일 염포부두 선박화재가 완진되어 시민여러분께서는 평소와 같은 일상으로 복귀하여 주시기 바랍니다.,cbs,울산광역시청,,,"[('평소와 같은', 0.6339)]"
2019/09/28 17:54:17,162,울산광역시 전체,24756,금일 동구 선박화재로 인한 울산대교 통제가 17시 47분부로 해제되었음을 알려드리오니 도로이용에 참고하시기 바랍니다.,cbs,울산광역시청,,,"[('통제가 17시', 0.6414)]"
2019/09/28 16:24:02,162,울산광역시 전체,24754,금일 동구 선박화재 발생. 바람방향에 따라 연기가 시내방향으로 확산됨. 시민들께서는 창문을 닫고 외출자제. 외출시 반드시 마스크 착용 등 안전유의.,cbs,울산광역시청,,,"[('동구 선박화재 발생', 0.6743)]"
2019/09/28 13:23:52,162,울산광역시 전체,24751,오늘 10시 51분경 동구 선박화재 발생. 유독연기 확산에 따라 주민들은 외출자제 및 외출시 반드시 마스크 착용 등 안전에 유의바랍니다.,cbs,울산광역시청,,,"[('외출시 반드시 마스크', 0.641)]"
2019/09/28 12:25:55,162,울산광역시 전체,24750,오늘 10시 51분경 동구 방어동 염포부두 선박화재 발생. 주민들께서는 화재연기로 인한 피해가 발생하지 않도록 외출자제 및 안전에 유의바랍니다.,cbs,울산광역시청,,,"[('오늘 10시 51분경', 0.691)]"
2019/09/28 11:32:52,162,울산광역시 전체,24749,오늘 10시51분경 동구 방어동 염포부두에 정박중인 선박화재 발생. 울산대교 통제하오니 주민 안전유의 및 차량 통행자는 우회바랍니다.229-3119,cbs,울산광역시청,,,"[('오늘 10시51분경 동구', 0.7047)]"
2019/09/22 16:00:12,162,울산광역시 전체,24732,"오늘 울산 태풍 접근중, 강풍과 폭우예상, 강풍으로 인한 낙하물 조심, 침수 및 산사태 우려지역은 안전한 곳으로 대피, 외출자제, 피해 예방바랍니다",cbs,울산광역시청,,,"[('산사태 우려지역은 안전한 곳으로', 0.7686)]"
2019/09/22 08:06:46,162,울산광역시 전체,24705,"오늘 태풍으로 강풍과 최대 300mm이상 강우량 예상, 낙하물 주의, 해안과 하천변 접근금지, 외출자제, 기상상황 수시 확인, 안전에 주의 바랍니다",cbs,울산광역시청,,,"[('태풍으로 강풍과', 0.5588)]"
2019/08/01 10:00:30,162,울산광역시 전체,24551,"오늘부터 최고온도 35도 2일이상 지속 예상, 기상상황 수시 확인, 가장 더운 오후 2시~ 5시는 야외활동 및 작업 자제, 폭염피해 예방바랍니다.",cbs,울산광역시청,,,"[('오후 2시 5시는', 0.6203)]"
2019/03/05 17:05:11,162,울산광역시 전체,24287,"3월5일 17시 울산전역 초미세먼지주의보, 어린이 노약자 실외활동 제한, 외출시 마스크 착용바랍니다. 229-6180~8",cbs,울산광역시청,,,"[('외출시 마스크 착용바랍니다', 0.5237)]"
2019/03/01 11:03:16,162,울산광역시 전체,24235,"3월 1일 11시 울산전역 미세먼지 주의보. 어린이, 노약자 실외활동 제한, 외출시 마스크 착용바랍니다.229-6180~8",cbs,울산광역시청,,,"[('제한 외출시 마스크 착용바랍니다', 0.5459)]"
2019/02/03 13:39:00,162,울산광역시 전체,24150,즐거운 설명절입니다.구제역확산방지를 위해 발생지역과 축산농가 방문을 가급적 삼가해주실 것을 요청드립니다.,cbs,울산광역시청,,,"[('설명절입니다 구제역확산방지를 위해 발생지역과', 0.6442)]"
2019/01/31 10:18:17,162,울산광역시 전체,24133,"오늘 10시 울산지역 대설주의보, 대중교통이용, 농수산물 보호, 내집앞 눈치우기, 눈길 조심하세요. 229-4641~7",cbs,울산광역시청,,,"[('농수산물 보호', 0.7259)]"
2018/10/06 10:42:11,166,울산광역시 울주군,23997,현재 청량면 회야댐 월류량이 증가되고 있으니 댐하류지역 주민과 통행인은 안전에유의하기 바랍니다.229-4636~47,cbs,울산광역시청,,,"[('현재 청량면 회야댐', 0.5791)]"
2018/10/06 10:30:45,162,울산광역시 전체,23996,"대암댐 수위상승, 기존 및 보조여수로월류. 댐하류침수우려, 주민 및 차량은 안전한장소로 이동바랍니다.229-3119",cbs,울산광역시청,,,"[('안전한장소로 이동바랍니다 229 3119', 0.6444)]"
2018/10/05 20:52:53,162,울산광역시 전체,23983,"오늘 21시 호우주의보, 저지대 차량이동,계곡야영객,침수우려지역 대피 등 피해 없도록 대비바랍니다.229-4636~47",cbs,울산광역시청,,,"[('없도록 대비바랍니다 229 4636', 0.6331)]"
2018/08/26 11:48:30,162,울산광역시 전체,23812,"호우로 태화강 등 하천수위가 급격히 상승, 하천둔치 주차차량은 피해가 없도록 신속히 이동조치 바랍니다.",cbs,울산광역시청,,,"[('이동조치 바랍니다', 0.7022)]"
2018/08/26 09:34:07,162,울산광역시 전체,23811,"금일 천둥 번개 및 많은 비 예상되니 하천변 주차차량, 저지대 침수, 야영객 등 인명피해에 유의하기 바랍니다.",cbs,울산광역시청,,,"[('침수 야영객 인명피해에 유의하기', 0.6909)]"
2018/08/23 20:50:30,162,울산광역시 전체,23795,"8. 23. 21:00 태풍주의보 발효, 호우,풍랑,특히 강풍에 의한 피해가 예상되니 안전에 유의바랍니다. 229-4636~47",cbs,울산광역시청,,,"[('안전에 유의바랍니다 229', 0.6682)]"
2018/07/03 11:22:09,162,울산광역시 전체,23664,"7월3일12시 울산지역 태풍주의보 발효, 침수우려지역 주차차량 이동 및 각종 시설물 관리 철저 등 대비 바랍니다.",cbs,울산광역시청,,,"[('시설물 관리 철저 대비', 0.5407)]"
2018/01/23 13:04:06,162,울산광역시 전체,3302,"금일 21시 울산 한파주의보 발효, 노약자 외출자제, 수도 동파방지, 농축수산시설 피해 및 화재 주의바랍니다.",cbs,울산광역시청,,,"[('동파방지 농축수산시설', 0.6653)]"
2017/11/15 14:51:20,162,울산광역시 전체,3092,"오늘 14시 29분경 경북 포항 6km 지점 규모 5.5지진발생, 여진주의, 운동장 등 안전한곳, 대피하세요. 229-4151~5",cbs,울산광역시청,,,"[('29분경 경북', 0.5598)]"
2017/10/22 16:17:54,162,울산광역시 전체,3025,"울산 앞바다 풍랑경보 계속, 어선 출항금지, 해안가 낚시야영객은 안전지대 대피바랍니다.",cbs,울산광역시청,,,"[('해안가 낚시야영객은 안전지대', 0.7267)]"
2017/10/22 15:21:02,162,울산광역시 전체,3023,"강풍경보 계속, 간판 표지판 등 부착물 낙하로 사고 우려, 공사장. 비닐하우스 등 시설물 피해 유의바랍니다.",cbs,울산광역시청,,,"[('비닐하우스 시설물 피해', 0.7044)]"
2017/09/11 07:29:18,162,울산광역시 전체,2969,"오늘 6시50분 호우경보발효, 하천변 주차차량 및 지난해 태풍 차바 침수지역은 침수에 대비하여 주시기 바랍니다",cbs,울산광역시청,,,"[('호우경보발효 하천변', 0.7454)]"
2017/07/13 17:09:42,162,울산광역시 전체,2662,"폭염 지속 예상, 야외활동 자제, 열대야 현상 있는 곳 있겠으니, 건강관리 각별히 유의 바랍니다",cbs,울산광역시청,,,"[('열대야 현상 있는', 0.6428)]"
2017/06/06 14:16:31,162,울산광역시 전체,2441,"닭,오리 고기를 끓이거나 가열(최소 70℃에서 30분 이상) 조리하여 드시면 안전합니다.",cbs,울산광역시청,최소 70℃에서 30분 이상,,"[('70 에서 30분 이상', 0.5509)]"
2017/06/06 10:44:49,162,울산광역시 전체,2436,"AI 관련, 5월27일이후 닭이나 오리를 구입하신 분은 시 농축산과(1588-4060), 구,군 축산부서로 신고 바랍니다.",cbs,울산광역시청,1588-4060,,"[('분은 농축산과 1588', 0.5067)]"
