create_date,location_id,location_name,md101_sn,msg,send_platform,cast,missing,age,keyword
2023/04/12 08:57:55,179,전라남도 전체,194391,"도내 전 지역 황사 위기경보 “주의단계” 발령으로 ▲어린이,노약자 실외활동 금지 ▲대중교통 이용 ▲보건용 마스크 착용 등 건강관리에 유의 바랍니다.",cbs,전라남도청,,,"[('마스크 착용 건강관리에 유의', 0.5992)]"
2023/01/24 18:53:17,"187,188,191,194","전라남도 목포시,전라남도 무안군,전라남도 신안군,전라남도 영암군",191715,"대설과 한파로 인해 간선도로 및 남악 JC 진출입 구간이 결빙되어 위험하니, 25일 출퇴근시 대중교통 이용 바랍니다.",cbs,전라남도청,,,"[('대설과 한파로 인해 간선도로', 0.647)]"
2022/12/23 18:40:58,"180,181,182,184,185,186,187,188,189,190,191,193,194,195,196,197,198,199,200,201","전라남도 강진군,전라남도 고흥군,전라남도 곡성군,전라남도 구례군,전라남도 나주시,전라남도 담양군,전라남도 목포시,전라남도 무안군,전라남도 보성군,전라남도 순천시,전라남도 신안군,전라남도 영광군,전라남도 영암군,전라남도 완도군,전라남도 장성군,전라남도 장흥군,전라남도 진도군,전라남도 함평군,전라남도 해남군,전라남도 화순군",187068,"눈이 긴 시간 이어지면서 쌓인 눈으로 도로가 미끄러우니, 퇴근길 감속운행 및 안전거리 확보하시고, 보행 시 빙판길 미끄럼사고에 주의하시기 바랍니다.",cbs,전라남도청,,,"[('감속운행 안전거리 확보하시고 보행', 0.7248)]"
2022/12/23 07:59:40,"183,190,192","전라남도 광양시,전라남도 순천시,전라남도 여수시",186847,제설작업이 마무리되어 폭설로 인한 이순신대교 교통 통제를 금일 오전 8시부로 해제합니다.,cbs,전라남도청,,,"[('제설작업이 마무리되어', 0.6308)]"
2022/12/23 06:56:05,"183,190,192","전라남도 광양시,전라남도 순천시,전라남도 여수시",186815,"폭설로 인해 이순신대교 차량 진입이 어려워 통행을 전면 통제하고 있으니, 출근길 차량은 우회 바랍니다.",cbs,전라남도청,,,"[('통행을 전면 통제하고', 0.6688)]"
2022/12/23 04:55:53,"183,190,192","전라남도 광양시,전라남도 순천시,전라남도 여수시",186783,"폭설로 인해 이순신대교 차량 진입이 어려워 통행을 전면 통제하고 있으니, 출근길 차량은 국도17호선 및 국도 2호선 등으로 우회 바랍니다.",cbs,전라남도청,,,"[('어려워 통행을 전면', 0.7)]"
2022/12/22 23:52:12,"183,190,192","전라남도 광양시,전라남도 순천시,전라남도 여수시",186779,"폭설로 인해 이순신대교 차량 진입이 어려워 현시간부로 차량통행을 전면 통제하니, 통행 차량은 국도 17호선 및 국도 2호선 등으로 우회 바랍니다.",cbs,전라남도청,,,"[('어려워 현시간부로', 0.6604)]"
2022/12/17 07:13:12,"185,186,187,188,191,193,196,199","전라남도 나주시,전라남도 담양군,전라남도 목포시,전라남도 무안군,전라남도 신안군,전라남도 영광군,전라남도 장성군,전라남도 함평군",185499,대설주의보 발효! 전남 서해안 최대 25cm 적설 예보 √낙상 등 미끄럼사고 주의 √결빙지역 저속운행 √온열기 이용시 화재에 유의바랍니다,cbs,전라남도청,,,"[('저속운행 온열기 이용시', 0.5981)]"
2022/12/01 07:08:50,179,전라남도 전체,183134,"한파특보가 발효 중입니다. 외출 시 보온에 유의하시고, 비 또는 눈이 오는 지역에는 도로가 미끄럽겠으니, 교통안전에 각별히 유의하시기 바랍니다.",cbs,전라남도청,,,"[('지역에는 도로가 미끄럽겠으니', 0.6897)]"
2022/11/30 07:01:05,179,전라남도 전체,182986,"한파 경보 발효중 ! 도로결빙 대비 대중교통 이용, 노약자 보온 유지 및 야외활동 자제, 수도관 등 보온조치, 온열기 화재방지 등 주의 바랍니다.",cbs,전라남도청,,,"[('도로결빙 대비 대중교통 이용', 0.7082)]"
2022/11/29 20:01:43,179,전라남도 전체,182976,오늘 21시 한파경보 발효 ▲체온 유지 ▲수도관·계량기 보온조치 ▲농작물 냉해·양식어류 동사 방지 ▲전열기구 화재예방 등 안전에 유의 바랍니다.,cbs,전라남도청,,,"[('냉해 양식어류 동사 방지', 0.678)]"
2022/08/19 10:40:30,"180,181,182,183,184,185,186,189,190,192,194,195,197,200,201","전라남도 강진군,전라남도 고흥군,전라남도 곡성군,전라남도 광양시,전라남도 구례군,전라남도 나주시,전라남도 담양군,전라남도 보성군,전라남도 순천시,전라남도 여수시,전라남도 영암군,전라남도 완도군,전라남도 장흥군,전라남도 해남군,전라남도 화순군",168640,▶폭염주의보 발표◀ 낮최고기온33도 이상 예보 □논밭 나홀로 작업금지 □야외근로자 물/그늘/휴식 확보 □장시간 실외활동을 자제하시기 바랍니다,cbs,전라남도청,,,"[('야외근로자 그늘 휴식 확보', 0.6924)]"
2022/08/12 10:27:16,179,전라남도 전체,167597,▶폭염주의보 발표◀ 낮최고기온33도 이상 예보 □논밭 나홀로 작업금지 □야외근로자 물/그늘/휴식 확보 □장시간 실외활동을 자제하시기 바랍니다,cbs,전라남도청,,,"[('야외근로자 그늘 휴식 확보', 0.6924)]"
2022/06/20 11:39:24,"182,183,184,185,186,190,194,196,200,201","전라남도 곡성군,전라남도 광양시,전라남도 구례군,전라남도 나주시,전라남도 담양군,전라남도 순천시,전라남도 영암군,전라남도 장성군,전라남도 해남군,전라남도 화순군",160587,"폭염특보 발효 중 충분히 물마시기, 무더위 쉼터 이용, 실외 작업장 안전수칙(물,그늘,휴식) 지키기 등 안전에 유의 하시기 바랍니다.",cbs,전라남도청,"물,그늘,휴식",,"[('발효 충분히 물마시기 무더위', 0.6898)]"
2022/06/19 12:26:45,"182,184,185,186,201","전라남도 곡성군,전라남도 구례군,전라남도 나주시,전라남도 담양군,전라남도 화순군",160481,폭염주의보 발효 중 ▶낮시간 야외활동 자제 ▶무리한 논밭작업 금지 ▶외출 시 모자나 양산 이용 등 폭염 피해가 없도록 주의하시기 바랍니다.,cbs,전라남도청,,,"[('논밭작업 금지 외출 모자나', 0.6138)]"
2022/03/25 22:35:43,179,전라남도 전체,149073,"현재 신안39.3, 영광32mm 등 도내 강수 지속 아침까지 강수가 이어지니 산사태, 침수우려지역 주민은 재난방송을 수시로 확인하시기 바랍니다.",cbs,전라남도청,,,"[('신안39 영광32mm 도내 강수', 0.6269)]"
2022/01/22 10:02:07,179,전라남도 전체,139286,"오미크론 도내 전역으로 확산 중 ▲접종 완료자도 KF94 마스크 착용 ▲ 밀폐장소, 다중이용시설 자제 바랍니다.",cbs,전라남도청,,,"[('밀폐장소 다중이용시설 자제', 0.4604)]"
2021/12/11 17:42:03,179,전라남도 전체,133331,12.11. 17시 기준 도내 59명 확진 ※ 전국 확진자 급증 √타 지역 방문 자제 √다중시설 마스크 착용 등 방역수칙 준수 바랍니다.,cbs,전라남도청,,,"[('59명 확진 전국', 0.5841)]"
2021/10/11 08:59:58,"180,181,182,183,184,185,186,187,188,189,191,192,193,194,195,196,197,198,199,200,201","전라남도 강진군,전라남도 고흥군,전라남도 곡성군,전라남도 광양시,전라남도 구례군,전라남도 나주시,전라남도 담양군,전라남도 목포시,전라남도 무안군,전라남도 보성군,전라남도 신안군,전라남도 여수시,전라남도 영광군,전라남도 영암군,전라남도 완도군,전라남도 장성군,전라남도 장흥군,전라남도 진도군,전라남도 함평군,전라남도 해남군,전라남도 화순군",125813,"10. 10. 24시 기준 확진 11명(목포3, 나주1, 고흥1, 장흥2, 무안4) ▲타지역 방문·접촉시 증상유무 관계없이 진단검사 받으세요.",cbs,전라남도청,"목포3, 나주1, 고흥1, 장흥2, 무안4",,"[('방문 접촉시 증상유무', 0.5617)]"
2021/07/07 13:56:58,179,전라남도 전체,111415,"계속된 집중호우로 지반이 약해져 산사태, 축대붕괴 등 위험 증가 ▲위험지역 주민들께서는 마을회관 등 지정장소로 대피하시기 바랍니다.",cbs,전라남도청,,,"[('축대붕괴 위험 증가 위험지역', 0.6129)]"
2021/02/14 08:35:59,179,전라남도 전체,91675,"강한 바람과 건조한 날씨로 산불이 자주 발생하고 있습니다. 산에 가실 때는 화기를 가져가지 마시고, 논·밭두렁 등을 절대 태우지 마시기 바랍니다.",cbs,전라남도청,,,"[('가실 때는 화기를 가져가지', 0.5934)]"
2021/02/07 15:26:44,179,전라남도 전체,90337,"설 연휴기간에도 √5인이상 사적모임 금지, 여행이동 자제, 마스크 착용 등 방역수칙 준수 √증상 의심되면 선별진료소 검사받으세요.",cbs,전라남도청,,,"[('금지 여행이동', 0.5483)]"
2020/08/09 10:15:33,179,전라남도 전체,43541,"최근 집중호우로 급격하게 물이 불어나 안전사고 발생 위험이 매우 높으니, 유량이 많은 계곡·하천에서의 물놀이를 금지하여 주시기 바랍니다.",cbs,전라남도청,,,"[('발생 위험이 매우 높으니', 0.6964)]"
2020/07/12 13:35:12,179,전라남도 전체,40444,"오늘 오후부터 우리 지역에 많은 비가 예상되니 상습침수 등 위험지역 주민은 사전 대피, 불필요한 외출은 자제 바랍니다. 061-286-3727",cbs,전라남도청,,,"[('예상되니 상습침수 위험지역', 0.6302)]"
2020/05/10 09:42:46,179,전라남도 전체,34830,"4.29(수)~5.6.(수) 서울 이태원 유흥시설(클럽, 주점) 방문자는 신분을 보장하여 검사를 진행하오니 시군 보건소에 신고하여 주시기 바랍니다.",cbs,전라남도청,수,,"[('29 서울', 0.5397)]"
2020/02/27 09:57:45,179,전라남도 전체,26849,"코로나19 예방을 위해 사람이 많은 곳 방문 자제, 발열·기침 등 호흡기 증상이 있을 때 병원 가기 전 시군 보건소나 1339로 먼저 상담바랍니다.",cbs,전라남도청,,,"[('있을 병원 가기', 0.6345)]"
2020/02/05 10:04:09,179,전라남도 전체,25242,신종 코로나바이러스 관련 본인이나 가족이 최근 14일 이내 중국 방문한 후 발열이나 호흡기 증상이 있을 경우 보건소 또는 1339로 상담 바랍니다.,cbs,전라남도청,,,"[('본인이나 가족이 최근', 0.6646)]"
2020/02/03 11:41:10,179,전라남도 전체,25198,신종 코로나바이러스 관련 1월 21일 이후 본인이나 가족이 중국 방문한 후 발열이나 호흡기 증상이 있을 경우 보건소 또는 1339로 상담바랍니다.,cbs,전라남도청,,,"[('발열이나 호흡기 증상이', 0.6748)]"
2020/02/03 11:34:28,179,전라남도 전체,25197,신종 코로나바이러스 관련 1월 21일 이후 본인이나 가족이 중국 방문한 후 발열이나 호흡기 증상이 있을 경우 보건소 또는 1399로 상담바랍니다.,cbs,전라남도청,,,"[('본인이나 가족이 중국', 0.6767)]"
2019/10/02 10:50:47,179,전라남도 전체,24781,"많은 비가 예상되니 노후저수지, 축대, 저지대, 산사태 등 붕괴 우려가 있는 위험지역 주민들께서는 마을회관 등 안전한 곳으로 미리 대피 바랍니다.",cbs,전라남도청,,,"[('마을회관 안전한 곳으로', 0.7188)]"
2019/09/28 17:19:55,179,전라남도 전체,24755,"제18호 태풍(미탁) 발생으로 10월 2일 영향 예상. 벼·과수 등 조기수확, 비닐하우스 등 시설물 피해 없도록 대비바랍니다(061-286-6471)",cbs,전라남도청,미탁,,"[('피해 없도록 대비바랍니다 061', 0.5932)]"
2019/09/22 11:43:06,179,전라남도 전체,24715,태풍 타파가 가깝게 다가오고 있어 체감하는 바람의 속도가 매우 강합니다. 도민 여러분께서는 많은 비와 바람에 철저한 사전 대비 바랍니다.,cbs,전라남도청,,,"[('체감하는 바람의', 0.732)]"
2019/09/21 16:00:20,179,전라남도 전체,24692,많은 비와 강풍을 동반한 태풍 타파로 농작물 침수 피해가 우려되고 있습니다. 물관리 등을 철저히 하여 농작물 피해가 없도록 대비하여 주시기 바랍니다,cbs,전라남도청,,,"[('타파로 농작물 침수', 0.6844)]"
2019/09/21 09:43:36,179,전라남도 전체,24688,많은 비와 강풍을 동반한 태풍 타파가 당초 예상보다 우리나라 쪽에 가깝게 다가오고 있으니 신속한 안전조치 등 피해가 없도록 사전대비 하시기 바랍니다,cbs,전라남도청,,,"[('피해가 없도록 사전대비', 0.6236)]"
2019/09/19 19:24:23,179,전라남도 전체,24685,"제17호 태풍 타파 9월 22일(일) 도내 상륙 예상. 벼·과수 조기수확, 비닐하우스 및 축사 등 피해가 없도록 대비 바랍니다.",cbs,전라남도청,일,,"[('비닐하우스 축사', 0.6084)]"
2019/09/19 19:02:14,179,전라남도 전체,24684,"제17호 태풍 타파 9월 22일(토) 도내 상륙 예상. 벼·과수 조기수확, 비닐하우스 및 축사 등 피해가 없도록 대비 바랍니다.",cbs,전라남도청,토,,"[('비닐하우스 축사', 0.6196)]"
2019/08/14 11:20:16,179,전라남도 전체,24592,"금일 현재 도내 전 지역에 폭염특보 발효 중. 야외활동 자제, 무더위 쉼터 이용, 충분한 물 마시기 등 건강에 유의바랍니다. 061-286-3722",cbs,전라남도청,,,"[('지역에 폭염특보 발효', 0.7001)]"
2019/08/13 14:29:08,179,전라남도 전체,24590,"금일 현재 도내 전 지역에 폭염특보(경보, 주의보) 발효 중. 야외활동 자제, 무더위 쉼터 이용, 충분한 물 마시기 등 건강에 유의바랍니다.",cbs,전라남도청,"경보, 주의보",,"[('경보 주의보 발효 야외활동', 0.6638)]"
2019/08/10 10:33:45,179,전라남도 전체,24580,"금일 현재 도내 전 지역에 폭염특보(경보, 주의보)가 발효중입니다. 야외활동 자제, 무더위 쉼터 이용, 충분한 물 마시기 등 건강에 유의바랍니다.",cbs,전라남도청,"경보, 주의보",,"[('충분한 마시기 건강에 유의바랍니다', 0.6191)]"
2019/08/09 11:46:27,179,전라남도 전체,24579,"금일 현재 도내 전 지역에 폭염특보(경보, 주의보)가 발효중입니다. 야외활동 자제, 무더위 쉼터 이용, 충분한 물 마시기 등 건강에 유의바랍니다.",cbs,전라남도청,"경보, 주의보",,"[('충분한 마시기 건강에 유의바랍니다', 0.6191)]"
2019/08/05 10:32:11,179,전라남도 전체,24563,"금일 현재 도내 전지역에 폭염특보(경보, 주의보)가 발효중입니다. 야외활동 자제, 무더위 쉼터 이용, 충분한 물 마시기 등 건강에 유의바랍니다.",cbs,전라남도청,"경보, 주의보",,"[('마시기 건강에', 0.5819)]"
2019/08/04 10:30:54,179,전라남도 전체,24561,"현재 도내 전지역에 폭염특보(경보, 주의보)가 발효중입니다. 야외활동 자제, 무더위 쉼터 이용, 충분한 물 마시기 등 건강에 유의바랍니다..",cbs,전라남도청,"경보, 주의보",,"[('무더위 쉼터 이용 충분한', 0.5386)]"
2019/08/03 10:34:22,179,전라남도 전체,24558,"8.3. 현재 도내 전지역에 폭염특보(경보, 주의보)가 발효중입니다. 야외활동 자제, 무더위 쉼터 이용, 충분한 물 마시기 등 건강에 유의바랍니다.",cbs,전라남도청,"경보, 주의보",,"[('충분한 마시기 건강에 유의바랍니다', 0.5417)]"
2019/07/19 14:24:12,179,전라남도 전체,24500,"20일 새벽, 전남 남해안 태풍 상륙 예상, 도민 여러분께서는 위험지역 접근금지, 선박대피, 농수산물 점검 등 피해가 없도록 대비 바랍니다.",cbs,전라남도청,,,"[('농수산물 점검 피해가', 0.5794)]"
2019/06/22 19:49:21,"182,184","전라남도 곡성군,전라남도 구례군",24468,"6.22. 18:25, 곡성, 구례 호우주의보 발효, 많은 비가 예상되오니 야영객 및 산간계곡, 하천 인근 주민은 안전에 주의하시기 바랍니다.",cbs,전라남도청,,,"[('주의하시기 바랍니다', 0.5809)]"
2019/04/05 08:45:49,179,전라남도 전체,24379,"최근 건조한 날씨로 산불 우려, 입산 시 화기물질 소지 금지, 논밭두렁 소각 금지 등 산불 발생에 유의바랍니다.",cbs,전라남도청,,,"[('화기물질 소지 금지', 0.4581)]"
2019/03/05 17:23:04,179,전라남도 전체,24292,"3월6일 미세먼지 비상저감조치 발령, 공공기관 짝수차량 운행(도민자율), 실외활동시 마스크 착용바랍니다 286-7051",cbs,전라남도청,도민자율,,"[('실외활동시 마스크 착용바랍니다 286', 0.6359)]"
2019/03/04 17:30:04,179,전라남도 전체,24272,"3월5일 미세먼지 비상저감조치 발령, 공공기관 홀수차량 운행(도민자율), 실외활동시 마스크 착용바랍니다 286-7051",cbs,전라남도청,도민자율,,"[('마스크 착용바랍니다 286 7051', 0.644)]"
2019/03/03 18:14:48,179,전라남도 전체,24260,"3월4일 미세먼지 비상저감조치 발령, 공공기관 짝수차량 운행(도민자율), 실외활동시 마스크 착용바랍니다 286-7051",cbs,전라남도청,도민자율,,"[('마스크 착용바랍니다 286 7051', 0.6421)]"
2019/02/28 20:55:50,"180,185,187,188,191,193,194,195,196,198,199,200","전라남도 강진군,전라남도 나주시,전라남도 목포시,전라남도 무안군,전라남도 신안군,전라남도 영광군,전라남도 영암군,전라남도 완도군,전라남도 장성군,전라남도 진도군,전라남도 함평군,전라남도 해남군",24229,"오늘 20시 전남 서부권 미세먼지 경보발령, 어린이 노약자 실외활동 자제, 외출 시 마스크 착용하시기 바랍니다.",cbs,전라남도청,,,"[('자제 외출 마스크', 0.5484)]"
2019/02/21 18:11:34,179,전라남도 전체,24197,"내일(2.22. 6~21시) 미세먼지 비상저감조치 발령, 공공기관 차량2부제(짝수차량운행), 적극 협조바랍니다(286-7051)",cbs,전라남도청,2.22. 6~21시,,"[('내일 22 21시', 0.5079)]"
2019/02/04 09:01:08,179,전라남도 전체,24156,"구제역 유입 방지를 위해 소독을 철저히 하고, 축산농가 방문을 자제해 주시기 바랍니다. (신고전화 1588-4060)",cbs,전라남도청,신고전화 1588-4060,,"[('신고전화 1588 4060', 0.6589)]"
2019/01/14 21:09:11,179,전라남도 전체,24108,"내일 (1.15. 06~21시) 미세먼지 비상저감조치 발령, 공공기관 차량 2부제(홀수차량 운행), 민간자율 참여바랍니다.",cbs,전라남도청,1.15. 06~21시,,"[('21시 미세먼지', 0.5978)]"
2018/12/28 10:51:32,"185,187,188,193,194,196,199","전라남도 나주시,전라남도 목포시,전라남도 무안군,전라남도 영광군,전라남도 영암군,전라남도 장성군,전라남도 함평군",24076,"금일 현재 대설특보 발효 중이니 외출 자제, 눈길 미끄럼 주의, 비닐하우스 등 시설물 안전관리에 유의바랍니다.",cbs,전라남도청,,,"[('비닐하우스 시설물', 0.6714)]"
2018/12/27 17:59:46,"188,193,199","전라남도 무안군,전라남도 영광군,전라남도 함평군",24073,"오늘 18시 대설주의보 발효. 외출 자제, 비닐하우스 등 시설물 관리 및 눈길 미끄럼 등 안전관리에 유의 바랍니다.",cbs,전라남도청,,,"[('자제 비닐하우스 시설물', 0.6676)]"
2018/10/06 18:02:51,179,전라남도 전체,24017,"태풍 뒤 강풍·풍랑주의보가 발효 중이니 해안도로, 방파제 등 안전사고 유의바랍니다.",cbs,전라남도청,,,"[('발효 중이니', 0.6599)]"
2018/10/05 18:48:32,179,전라남도 전체,23982,제25호 태풍 콩레이가 전남지역을 통과하는 오늘 밤부터 내일 오전까지 불필요한 외출을 삼가해 주시기바랍니다.,cbs,전라남도청,,,"[('오늘 밤부터 내일 오전까지', 0.6281)]"
2018/09/03 23:49:02,"188,191,193,196,199","전라남도 무안군,전라남도 신안군,전라남도 영광군,전라남도 장성군,전라남도 함평군",23944,"현재 도내 호우특보 발효중으로 많은 비가 예상 되오니, 상습침수 · 위험지역 대피 등 안전에 유의바랍니다.",cbs,전라남도청,,,"[('발효중으로 많은', 0.6999)]"
2018/08/31 10:17:37,"182,183,184,185,186,188,189,190,191,193,196,199,201","전라남도 곡성군,전라남도 광양시,전라남도 구례군,전라남도 나주시,전라남도 담양군,전라남도 무안군,전라남도 보성군,전라남도 순천시,전라남도 신안군,전라남도 영광군,전라남도 장성군,전라남도 함평군,전라남도 화순군",23921,"전남 13시군 호우주의보 발령(최대 200mm 예상), 상습침수·위험지역 대피, 외출자제 등 안전에 주의바랍니다.",cbs,전라남도청,최대 200mm 예상,,"[('상습침수 위험지역', 0.5453)]"
2018/08/30 15:16:14,179,전라남도 전체,23892,"오늘부터 전남지역에 집중호우(50~150mm)가 예상, 상습침수, 위험지역 대피, 외출자제 등 안전에 주의 바랍니다.",cbs,전라남도청,50~150mm,,"[('예상 상습침수', 0.4821)]"
2018/08/27 14:36:30,179,전라남도 전체,23835,"전남 지역 집중 호우로 인한 침수, 산사태, 교통사고 등 피해에 유의하시기 바랍니다.",cbs,전라남도청,,,"[('호우로 인한', 0.5991)]"
2018/08/23 16:24:48,"187,188,191,194","전라남도 목포시,전라남도 무안군,전라남도 신안군,전라남도 영암군",23788,"현재 시간 태풍 솔릭 목포권 접근 중, 하천·해안가·논밭 출입을 삼가하시고 강풍·폭우에 유의하시기 바랍니다.",cbs,전라남도청,,,"[('시간 태풍 솔릭', 0.741)]"
2018/08/23 11:53:44,179,전라남도 전체,23783,"오늘 13시 전남 서남부 태풍 경보 발효, 하천·해안가·논밭 출입을 삼가하시고 강풍에 유의바랍니다.",cbs,전라남도청,,,"[('전남 서남부', 0.5987)]"
2018/08/23 08:27:27,179,전라남도 전체,23779,태풍 북상에 따라 영·유아 안전을 위해 8.23.(목) 어린이집이 자율적 휴원조치 됨을 알려드립니다. 061-286-5931,cbs,전라남도청,목,,"[('북상에 따라 유아', 0.5555)]"
2018/08/22 22:38:06,179,전라남도 전체,23777,태풍 솔릭으로 인해 8.23.(목) 전남 도내 유·초·중·고·특수학교가 휴업조치 됨을 알려드립니다. 061-260-0422,cbs,전라남도청,목,,"[('알려드립니다 061 260 0422', 0.6324)]"
2018/08/22 22:15:00,179,전라남도 전체,23776,"8.22. 21:00 전남에 태풍주의보 발효, 강풍, 폭우, 풍랑에 대비하시기 바랍니다.",cbs,전라남도청,,,"[('발효 강풍 폭우 풍랑에', 0.5247)]"
2018/08/20 15:22:44,179,전라남도 전체,23763,"제19호 태풍 솔릭이 8.22.~23. 전남 내륙 관통 예보, 호우·강풍 피해 대비 및 사전 점검에 유의하시기 바랍니다.",cbs,전라남도청,,,"[('피해 대비 사전 점검에', 0.6158)]"
2018/07/23 11:50:08,179,전라남도 전체,23704,"금일 도내 대부분 지역에 폭염특보 발효 중, 야외활동 자제, 농수축산 농가 는 폭염 피해에 유의하시기 바랍니다.",cbs,전라남도청,,,"[('농가 폭염 피해에', 0.7251)]"
2018/07/18 14:25:13,179,전라남도 전체,23693,"오늘 현재 폭염경보 발효, 야외활동 자제와 충분한 물마시기 등 농·수·축산농가 폭염피해에 유의하시기 바랍니다",cbs,전라남도청,,,"[('현재 폭염경보 발효', 0.6423)]"
2018/07/03 21:32:22,179,전라남도 전체,23673,전남 육상지역은 오늘 22시경 태풍영향권에서 벗어났으나 해상에는 풍랑· 강풍 특보가 발효중이니 주의 바랍니다.,cbs,전라남도청,,,"[('주의 바랍니다', 0.6019)]"
2018/07/03 14:11:41,179,전라남도 전체,23666,"7. 3. 현재 전남 남해안 지역 강풍주의보, 전 해상 풍랑주의보 발효 중이니 안전에 주의 바랍니다.",cbs,전라남도청,,,"[('지역 강풍주의보', 0.5682)]"
2018/07/03 10:32:59,"180,182,184,185,186,187,188,191,193,194,195,196,197,198,199,200,201","전라남도 강진군,전라남도 곡성군,전라남도 구례군,전라남도 나주시,전라남도 담양군,전라남도 목포시,전라남도 무안군,전라남도 신안군,전라남도 영광군,전라남도 영암군,전라남도 완도군,전라남도 장성군,전라남도 장흥군,전라남도 진도군,전라남도 함평군,전라남도 해남군,전라남도 화순군",23663,"7.3. 현재 전남 남해안 태풍 영향권, 강풍·풍랑·해수면 상승에 주의 바랍니다.",cbs,전라남도청,,,"[('해수면 상승에 주의', 0.5785)]"
2018/07/02 20:33:03,"183,192","전라남도 광양시,전라남도 여수시",23661,이순신대교 통과 시 강풍이 발생할 경우에는 서행 운행하시기 바랍니다. 061-286-7432,cbs,전라남도청,,,"[('경우에는 서행', 0.4605)]"
2018/07/01 15:11:31,179,전라남도 전체,23649,"7.2. 밤 전남 태풍 영향권 예상, 호우·강풍·해수면 상승에 따른 인명피해, 침수, 산사태 등 미리 대비 바랍니다.",cbs,전라남도청,,,"[('예상 호우 강풍', 0.4962)]"
2018/07/01 09:32:06,189,전라남도 보성군,23645,"금일 보성군 내 200mm이상의 폭우 발생, 침수 및 산사태가 예상되는 인근 군민께서는 안전한 곳으로 대피바랍니다.",cbs,전라남도청,,,"[('안전한 곳으로 대피바랍니다', 0.3174)]"
