2018/06/02 11:07:38,"182,184,185,201","전라남도 곡성군,전라남도 구례군,전라남도 나주시,전라남도 화순군",23608,"6. 2. 11시 폭염주의보가 발효되었으니, 노약자 야와활동 자제, 충분한 수분섭취 등 건강에 유의 바랍니다.",cbs,전라남도청,,,"[('충분한 수분섭취', 0.4025)]"
2018/04/15 13:20:30,"180,185,187,188,191,193,194,195,196,198,199,200","전라남도 강진군,전라남도 나주시,전라남도 목포시,전라남도 무안군,전라남도 신안군,전라남도 영광군,전라남도 영암군,전라남도 완도군,전라남도 장성군,전라남도 진도군,전라남도 함평군,전라남도 해남군",3536,"오늘 13시 도내 서부권역 미세먼지 경보 발령, 어린이 및 노약자 실외활동 자제, 외출 시 마스크 착용바랍니다.",cbs,전라남도청,,,"[('미세먼지 경보', 0.5493)]"
2018/02/06 07:47:44,"180,187,188,191,193,194,195,196,198,199,200","전라남도 강진군,전라남도 목포시,전라남도 무안군,전라남도 신안군,전라남도 영광군,전라남도 영암군,전라남도 완도군,전라남도 장성군,전라남도 진도군,전라남도 함평군,전라남도 해남군",3367,"최고 18cm 적설, 대중교통 이용, 축사, 비닐하우스 눈 제거, 눈길 미끄럼 주의 등 피해 없도록 주의 바랍니다.",cbs,전라남도청,,,"[('대중교통 이용', 0.5656)]"
2018/02/04 16:48:34,"182,184,185,186,189,193,196,201","전라남도 곡성군,전라남도 구례군,전라남도 나주시,전라남도 담양군,전라남도 보성군,전라남도 영광군,전라남도 장성군,전라남도 화순군",3361,"오늘 21:00 한파주의보 발효예정이니 노약자 외출자제, 건강관리, 수도관 동파방지, 양식장 관리등에 유의바랍니다.",cbs,전라남도청,,,"[('한파주의보 발효예정이니 노약자', 0.6654)]"
2018/02/03 19:01:41,"187,188,191,193,198,199","전라남도 목포시,전라남도 무안군,전라남도 신안군,전라남도 영광군,전라남도 진도군,전라남도 함평군",3357,"2.4.(일) 새벽 대설주의보 발효예정. 노약자 외출자제, 교통안전, 눈길 미끄럼 주의, 시설물 관리에 유의바랍니다.",cbs,전라남도청,일,,"[('대설주의보 발효예정', 0.4641)]"
2018/01/23 13:41:20,"180,182,184,185,186,188,189,190,193,194,196,197,199,200,201","전라남도 강진군,전라남도 곡성군,전라남도 구례군,전라남도 나주시,전라남도 담양군,전라남도 무안군,전라남도 보성군,전라남도 순천시,전라남도 영광군,전라남도 영암군,전라남도 장성군,전라남도 장흥군,전라남도 함평군,전라남도 해남군,전라남도 화순군",3305,"1.23일 21:00 한파주의보가 발효되었으니 노약자 외출자제, 수도계량기 보온조치 등 필요한 조치를 취하기 바랍니다",cbs,전라남도청,,,"[('00 한파주의보가 발효되었으니 노약자', 0.5319)]"
2018/01/11 09:17:01,"185,187,188,191,193,194,196,199,201","전라남도 나주시,전라남도 목포시,전라남도 무안군,전라남도 신안군,전라남도 영광군,전라남도 영암군,전라남도 장성군,전라남도 함평군,전라남도 화순군",3267,"폭설로 비닐하우스, 축사 등 시설물 붕괴위험 있으니, 눈을 제거하시고 외출자제, 수도계량기 보온 조치 바랍니다.",cbs,전라남도청,,,"[('축사 시설물', 0.6863)]"
2018/01/10 18:35:19,179,전라남도 전체,3257,"도내 대설특보 발효 중, 내 집 앞 및 비닐하우스 눈치우기, 빙판길 교통사고가 우려되니 대중교통을 이용 바랍니다.",cbs,전라남도청,,,"[('교통사고가 우려되니 대중교통을 이용', 0.6058)]"
2018/01/10 09:35:39,179,전라남도 전체,3234,"오늘부터 모레까지 많은 눈과 한파예상. 노약자 외출자제, 상수도 동파예방, 교통안전, 시설물관리에 유의바랍니다",cbs,전라남도청,,,"[('노약자 외출자제 상수도', 0.6629)]"
2017/12/16 17:06:44,"187,188,191,193,196,198,199","전라남도 목포시,전라남도 무안군,전라남도 신안군,전라남도 영광군,전라남도 장성군,전라남도 진도군,전라남도 함평군",3188,"내일 아침까지 많은 눈이 예상되니, 시설물 관리와 대중교통 이용 및 미끄럼 사고 등에 주의바랍니다.",cbs,전라남도청,,,"[('내일 아침까지 많은 눈이', 0.6621)]"
2017/12/11 17:55:21,"185,186,187,188,191,193,196,199","전라남도 나주시,전라남도 담양군,전라남도 목포시,전라남도 무안군,전라남도 신안군,전라남도 영광군,전라남도 장성군,전라남도 함평군",3166,"오늘밤부터 내일까지 대설, 강풍이 예상되니 빙판길 안전사고, 시설물 관리 등 피해가 없도록 주의바랍니다.",cbs,전라남도청,,,"[('빙판길 안전사고 시설물', 0.6824)]"
2017/09/16 09:00:06,"180,181,183,189,190,192,195,197","전라남도 강진군,전라남도 고흥군,전라남도 광양시,전라남도 보성군,전라남도 순천시,전라남도 여수시,전라남도 완도군,전라남도 장흥군",2985,태풍의 영향으로 전남 남해안에 강한 비바람이 불겠습니다. 시설물 안전관리와 인명피해가 없도록 주의바랍니다.,cbs,전라남도청,,,"[('인명피해가 없도록', 0.6496)]"
2017/07/15 07:12:02,"186,193,196","전라남도 담양군,전라남도 영광군,전라남도 장성군",2667,"현재 담양, 영광, 장성지역 호우주의보 발효, 상습침수 등 대비, 외출자제 등 안전에 주의하세요.",cbs,전라남도청,,,"[('호우주의보 발효', 0.7066)]"
