create_date,location_id,location_name,md101_sn,msg,send_platform,cast,missing,age,keyword
2023/09/20 16:46:58,246,충청북도 진천군,205433,현재 호우주의보 발효중 ▲하천변 접근 금지 ▲농수로 물꼬 확인 금지 ▲산사태우려지역 및 저지대 위험지역은 안전에 유의하시기 바랍니다.,cbs,진천군,,,"[('물꼬 확인 금지 산사태우려지역', 0.7798)]"
2023/08/23 16:05:11,246,충청북도 진천군,204240,현재 호우경보 발효중 ▲하천변 접근 금지 ▲농수로 물꼬 확인 금지 ▲산사태우려지역 및 저지대 침수지역은 안전에 각별히 유의하시기 바랍니다.,cbs,진천군,,,"[('산사태우려지역 저지대', 0.7881)]"
2023/08/11 08:53:39,246,충청북도 진천군,203041,태풍 '카눈'의 영향으로 백곡저수지 수위가 상승하여 방류량 증가 및 급격한 하천수위 상승이 예상되니 하천변 접근을 금지하여 주시기바랍니다.,cbs,진천군,,,"[('증가 급격한 하천수위 상승이', 0.4517)]"
2023/08/10 17:33:30,246,충청북도 진천군,202969,"태풍주의보 발효중▲하천변, 농배수로 출입금지▲산사태 우려지역은 안전한 곳으로 대피하여 주시고 강풍에 의한 낙하물 주의 등 외출을 자제하여 주시기 바랍니다",cbs,진천군,,,"[('산사태 우려지역은 안전한 곳으로', 0.7669)]"
2023/08/10 12:03:16,246,충청북도 진천군,202725,"태풍경보 발효▲하상주차장 통제▲하수종말처리장 앞 세월교~농다리 구간 통제▲외출을 자제하시고, 하천변 접근금지 및 산사태위험지역 사전 대피하시기 바랍니다.",cbs,진천군,,,"[('접근금지 산사태위험지역 사전', 0.7826)]"
2023/08/09 14:37:38,246,충청북도 진천군,202000,태풍 카눈 북상에 따라 금일(9일)15시부터 백곡저수지 방류예정으로 18시부터 백곡천 하상주차장 전면통제 계획이오니 주차장 내 주차를 삼가하시기바랍니다,cbs,진천군,9일,,"[('따라 금일 9일 15시부터', 0.6597)]"
2023/08/07 11:41:07,246,충청북도 진천군,201562,"폭염경보 발효중▲당분간 무더위 지속▲장시간 농작업, 나홀로 작업 및 비닐하우스 작업을 자제하고 충분한 휴식과 수분섭취 등 온열질환에 유의하기 바랍니다.",cbs,진천군,,,"[('당분간 무더위 지속 장시간', 0.7162)]"
2023/08/06 12:27:49,246,충청북도 진천군,201413,"폭염경보 발효중▲당분간 무더위 지속▲장시간 농작업, 나홀로 작업 및 비닐하우스 작업을 자제하고 충분한 휴식과 수분섭취 등 온열질환에 유의하기 바랍니다.",cbs,진천군,,,"[('당분간 무더위 지속 장시간', 0.7162)]"
2023/08/05 12:00:04,246,충청북도 진천군,201221,"폭염경보 발효중▲당분간 무더위 지속▲장시간 농작업, 나홀로 작업 및 비닐하우스 작업을 자제하고 충분한 휴식과 수분섭취 등 온열질환에 유의하기 바랍니다.",cbs,진천군,,,"[('당분간 무더위 지속 장시간', 0.7162)]"
2023/08/04 11:49:57,246,충청북도 진천군,201043,"폭염경보 발효중▲온열질환 사망자 발생▲장시간 농작업, 나홀로 작업 및 비닐하우스 작업을 자제하고 충분한 휴식과 수분섭취 등 온열질환에 유의하기 바랍니다.",cbs,진천군,,,"[('농작업 나홀로 작업 비닐하우스', 0.7155)]"
2023/08/03 17:30:53,246,충청북도 진천군,200973,"코로나19 확산세 증가 중 ▲ 실내외 활동시 마스크착용과 30초 이상 손씻기, 실내환기 등 개인방역수칙을 철저히 하여 감염에 유의하여 주시기 바랍니다.",cbs,진천군,,,"[('실내외 활동시 마스크착용과', 0.6803)]"
2023/08/03 11:35:11,246,충청북도 진천군,200887,"폭염경보 발효중▲온열질환 사망자 발생▲장시간 농작업, 나홀로 작업 및 비닐하우스 작업을 자제하고 충분한 휴식과 수분섭취 등 온열질환에 유의하기 바랍니다.",cbs,진천군,,,"[('농작업 나홀로 작업 비닐하우스', 0.7155)]"
2023/08/02 11:51:11,246,충청북도 진천군,200757,"폭염경보 발효중▲온열질환 사망자 발생▲장시간 농작업, 나홀로 작업 및 비닐하우스 작업을 자제하고 충분한 휴식과 수분섭취 등 온열질환에 유의하기 바랍니다.",cbs,진천군,,,"[('농작업 나홀로 작업 비닐하우스', 0.7155)]"
2023/08/01 13:13:51,246,충청북도 진천군,200629,"폭염경보 발효중▲온열질환 사망자 발생▲장시간 농작업, 나홀로 작업 및 비닐하우스 작업을 자제하고 충분한 휴식과 수분섭취 등 온열질환에 유의하기 바랍니다.",cbs,진천군,,,"[('농작업 나홀로 작업 비닐하우스', 0.7155)]"
2023/07/30 12:07:30,246,충청북도 진천군,200305,"폭염경보 발효중▲외출 및 야외활동 자제▲장시간 농작업, 나홀로 작업 및 비닐하우스 작업을 자제하여 온열질환에 유의하시기 바랍니다.",cbs,진천군,,,"[('폭염경보 발효중', 0.7535)]"
2023/07/29 12:02:32,246,충청북도 진천군,200147,"폭염경보 발효중▲외출 및 야외활동 자제▲장시간 농작업, 나홀로 작업 및 비닐하우스 작업을 자제하여 온열질환에 유의하시기 바랍니다.",cbs,진천군,,,"[('폭염경보 발효중', 0.7535)]"
2023/07/28 10:08:52,246,충청북도 진천군,200011,"폭염경보 발효중▲외출 및 야외활동 자제▲장시간 농작업, 나홀로 작업 및 비닐하우스 작업을 자제하여 온열질환에 유의하시기 바랍니다.",cbs,진천군,,,"[('폭염경보 발효중', 0.7535)]"
2023/07/22 14:25:39,246,충청북도 진천군,199325,"23일 새벽 강한 비가 내릴 것으로 예상됩니다. 산사태위험지역 사전대피, 농경지 확인금지, 하천변 접근금지 등 인명피해가 없도록 안전에 유의하시기바랍니다",cbs,진천군,,,"[('농경지 확인금지 하천변', 0.6777)]"
2023/07/21 18:30:09,246,충청북도 진천군,199159,주말 많은비가 예상되어 백곡저수지 방류계획으로 22일(토) 오전9시부터 백곡천 하상주차장을 전면통제할 예정이오니 주차장내 주차를 삼가하여 주시기바랍니다.,cbs,진천군,토,,"[('하상주차장을 전면통제할', 0.6434)]"
2023/07/19 10:32:08,246,충청북도 진천군,198980,"백곡저수지 방류중단으로 백곡천하상주차장이 10시부로 임시개방되었음을 알려드리며, 주말에 많은 비가 예상되어 추후 통제될 수 있으니 안전에 유의바랍니다.",cbs,진천군,,,"[('추후 통제될 있으니 안전에', 0.6316)]"
2023/07/18 13:13:10,246,충청북도 진천군,198635,"금일 밤까지 강하고 많은 비가 예상됩니다. 저수지 방류중으로 하천변 접근금지, 하상주차장 통제, 산사태우려지역은 사전대피하고 안전에 유의하기바랍니다.",cbs,진천군,,,"[('저수지 방류중으로 하천변', 0.7628)]"
2023/07/17 18:04:32,246,충청북도 진천군,198456,"금일 밤부터 19일까지 많은 비가 예상됩니다. 저수지 방류중으로 하천변 접근금지, 하상주차장 통제, 산사태우려지역은 사전대피하고 안전에 유의하기바랍니다.",cbs,진천군,,,"[('저수지 방류중으로 하천변', 0.7826)]"
2023/07/15 08:04:50,246,충청북도 진천군,197754,초평면 중석리 일원 국도34호선-중부고속도로 접속부 굴다리 침수로 이전 사거리에서 우회하시기 바랍니다.,cbs,진천군,,,"[('이전 사거리에서 우회하시기 바랍니다', 0.6979)]"
2023/07/14 17:18:36,246,충청북도 진천군,197499,호우경보 발효중 ▲7.14.(금) 18시 백곡저수지 방류 예정▲백곡천 하상주차장 및 산책로 접근금지,cbs,진천군,금,,"[('백곡저수지 방류', 0.6695)]"
2023/07/14 14:37:49,246,충청북도 진천군,197436,"호우주의보 발효중▲백곡저수지 방류 예정▲백곡천 하상주차장 및 산책로 전면통제▲산사태, 상습침수, 위험지역대피 등 군민의 생명과 안전에 주의바랍니다.",cbs,진천군,,,"[('위험지역대피 군민의 생명과', 0.7657)]"
2023/07/14 05:02:48,246,충청북도 진천군,197236,"05시 진천군 호우경보 발효. 집중호우가 예상되니 하천변, 위험지역에 접근하지 마시고, 배수시설 점검 등 안전사고 예방에 철저를 기해 주시기 바랍니다.",cbs,진천군,,,"[('위험지역에 접근하지 마시고', 0.723)]"
2017/08/21 15:40:39,246,충청북도 진천군,2914,"안전안내, 17:20백곡저수지 방류량 증가 예정. 백사천 하상주차장내 주차 차량을 안전한 곳으로 이동 주차바랍니다.",cbs,진천군,,,"[('주차 차량을 안전한', 0.5796)]"
2017/07/04 05:19:06,246,충청북도 진천군,2606,오늘 04:00 문백면 지역 산사태 주의보 발령. 위험지역 내 주민들은 안전에 유의하세요,cbs,진천군,,,"[('04 00 문백면', 0.6505)]"
