create_date,location_id,location_name,md101_sn,msg,send_platform,cast,missing,age,keyword
2023/11/18 05:57:12,"10188,10214,10256,10751,10761","경상남도 창원시 의창구,경상남도 창원시 성산구,경상남도 창원시 마산합포구,경상남도 창원시 마산회원구,경상남도 창원시 진해구",206816,"현재 우리 시에 눈발 날림으로 인한 도로결빙과 추위가 예상되오니 안전운전, 보행 및 건강관리에 유의바랍니다.",cbs,창원시,,,"[('우리 시에 눈발 날림으로', 0.7307)]"
2023/09/21 07:38:56,"10188,10214,10256,10751,10761","경상남도 창원시 의창구,경상남도 창원시 성산구,경상남도 창원시 마산합포구,경상남도 창원시 마산회원구,경상남도 창원시 진해구",205606,"강풍주의보 및 풍랑주의보 발효 중, 해안가 시설물 안전점검과 계속된 호우로 인한 축대 붕괴, 논 물꼬작업 등으로 인한 안전사고 발생에 유의 바랍니다.",cbs,창원시,,,"[('발생에 유의 바랍니다', 0.6857)]"
2023/09/20 18:44:09,"10188,10214,10256,10751,10761","경상남도 창원시 의창구,경상남도 창원시 성산구,경상남도 창원시 마산합포구,경상남도 창원시 마산회원구,경상남도 창원시 진해구",205484,"내일(21일)까지 많은 비와 강풍이 예상됩니다. 배수로 점검, 낙하물 주의, 해안가, 하천변 출입금지 등 안전에 유의하시기 바랍니다.",cbs,창원시,21일,,"[('내일 21일 까지 많은', 0.6639)]"
2023/09/16 10:23:54,"10188,10214,10256,10751,10761","경상남도 창원시 의창구,경상남도 창원시 성산구,경상남도 창원시 마산합포구,경상남도 창원시 마산회원구,경상남도 창원시 진해구",205158,"많은 비로 인하여 토월지하차도 통제중, 하천변, 지하차도, 해안가 등 위험지역 출입금지, 안전에 유의해 주시기 바랍니다",cbs,창원시,,,"[('출입금지 안전에 유의해', 0.7469)]"
2023/08/24 07:09:46,"10188,10214,10256,10751,10761","경상남도 창원시 의창구,경상남도 창원시 성산구,경상남도 창원시 마산합포구,경상남도 창원시 마산회원구,경상남도 창원시 진해구",204329,"창원지역 호우주의보 발효(오늘 00시20분) 중. 하천변, 축대 및 옹벽 주변에 접근을 금하여 주시고, 집중호우 시 불필요한 야외작업을 피하여 주세요.",cbs,창원시,오늘 00시20분,,"[('접근을 금하여 주시고', 0.7385)]"
2023/08/23 09:25:48,"10188,10214,10256,10751,10761","경상남도 창원시 의창구,경상남도 창원시 성산구,경상남도 창원시 마산합포구,경상남도 창원시 마산회원구,경상남도 창원시 진해구",204086,"오늘(23일) 14시 민방위 훈련실시, 대피소 확인(네이버,카카오,티맵,안전디딤돌앱). 일부구간 차량통제 15분 실시 (구간확인 : 창원시 홈페이지)",cbs,창원시,23일,,"[('23일 14시', 0.6218)]"
2023/08/10 18:00:16,"10257,10266,10720,10722,10724,10745,10748,10749,10750,10760","경상남도 창원시 마산합포구,경상남도 창원시 마산합포구,경상남도 창원시 마산합포구,경상남도 창원시 마산합포구,경상남도 창원시 마산합포구,경상남도 창원시 마산합포구,경상남도 창원시 마산합포구,경상남도 창원시 마산합포구,경상남도 창원시 마산합포구,경상남도 창원시 마산회원구",202980,"국도5호선 쌀재터널에서 내서방면 3km 지점 도로사변유실 복구로 인하여 도로 통제 중, 금일 19시경 통행 예정이오니 우회하여 주시기 바랍니다.",cbs,창원시,,,"[('인하여 도로 통제', 0.5508)]"
2023/08/10 13:17:11,"10188,10214,10256,10751,10761","경상남도 창원시 의창구,경상남도 창원시 성산구,경상남도 창원시 마산합포구,경상남도 창원시 마산회원구,경상남도 창원시 진해구",202780,국도5호선 쌀재터널에서 내서읍방향 3km지점 산사태로 인하여 양방향 차량통제 중. 17시 이후 정상화 예정이니 우회도로 이용을 바랍니다.,cbs,창원시,,,"[('이후 정상화', 0.5369)]"
2023/08/10 10:42:02,"10205,10206,10210","경상남도 창원시 의창구,경상남도 창원시 의창구,경상남도 창원시 의창구",202625,내동천 수위 내려감에 따라 의창구 팔용동 1-1 천차만차 인근 대피 해제합니다. 안전에 주의바랍니다.,cbs,창원시,,,"[('내동천 수위 내려감에', 0.6573)]"
2023/08/10 09:33:07,"10188,10214,10256,10751,10761","경상남도 창원시 의창구,경상남도 창원시 성산구,경상남도 창원시 마산합포구,경상남도 창원시 마산회원구,경상남도 창원시 진해구",202533,국도5호선 쌀재터널에서 내서읍방향 3km지점 산사태로 인하여 양방향 차량통행 금지하오니 안전을 위하여 우회하여 주시기 바랍니다.,cbs,창원시,,,"[('산사태로 인하여 양방향', 0.6203)]"
2023/08/10 09:07:59,"10188,10214,10256,10751,10761","경상남도 창원시 의창구,경상남도 창원시 성산구,경상남도 창원시 마산합포구,경상남도 창원시 마산회원구,경상남도 창원시 진해구",202503,"진전면 옥방교, 광려천 범람 우려로 인근지역 차량통행 및 이동을 제한해 주시기 바랍니다.",cbs,창원시,,,"[('차량통행 이동을 제한해', 0.723)]"
2023/08/10 09:00:49,"10188,10214,10256,10751,10761","경상남도 창원시 의창구,경상남도 창원시 성산구,경상남도 창원시 마산합포구,경상남도 창원시 마산회원구,경상남도 창원시 진해구",202494,"의창구 팔용동 1-1 천차만차 인근 범람으로 근접 지역은 팔용농산물도매시장으로 대피 바라며, 창원천.남천 하천 범람 우려로 우회도로를 이용바랍니다.",cbs,창원시,,,"[('창원천 남천', 0.6527)]"
2023/08/10 08:51:53,"10748,10749,10750","경상남도 창원시 마산합포구,경상남도 창원시 마산합포구,경상남도 창원시 마산합포구",202487,"진전면 진전천 의산보건소 뒤편 하천제방 유실, 인근 주민들께서는 인근 접근을 금하여 주시기 바랍니다.",cbs,창원시,,,"[('뒤편 하천제방 유실', 0.77)]"
2023/08/10 08:42:51,"10188,10214,10256,10751,10761","경상남도 창원시 의창구,경상남도 창원시 성산구,경상남도 창원시 마산합포구,경상남도 창원시 마산회원구,경상남도 창원시 진해구",202474,"태풍에 의한 강풍, 많은 비로 마창대교 통제 중, 마창대교 이용 차량은 우회 바랍니다.",cbs,창원시,,,"[('의한 강풍', 0.7051)]"
2023/08/10 08:31:35,"10188,10214,10256,10751,10761","경상남도 창원시 의창구,경상남도 창원시 성산구,경상남도 창원시 마산합포구,경상남도 창원시 마산회원구,경상남도 창원시 진해구",202461,많은 비로 인해 하천범람 위험이 있으니 안전을 위하여 외출자제 및 하천주변 접근을 금지하여 주시기 바랍니다.,cbs,창원시,,,"[('금지하여 주시기', 0.6829)]"
2023/08/10 08:18:37,"10188,10214,10256,10751,10761","경상남도 창원시 의창구,경상남도 창원시 성산구,경상남도 창원시 마산합포구,경상남도 창원시 마산회원구,경상남도 창원시 진해구",202447,"마산 진전면, 진북면, 진동면 일대 도로침수로 인하여 차량통행이 어려우니 안전을 위하여 우회하여 주시기 바랍니다.",cbs,창원시,,,"[('일대 도로침수로 인하여', 0.7297)]"
2023/08/10 08:04:29,"10188,10214,10256,10751,10761","경상남도 창원시 의창구,경상남도 창원시 성산구,경상남도 창원시 마산합포구,경상남도 창원시 마산회원구,경상남도 창원시 진해구",202429,창원시 전역에 지하차도 침수로 인하여 통행을 금지하오니 안전을 위하여 우회하여 주시기 바랍니다.,cbs,창원시,,,"[('전역에 지하차도', 0.6585)]"
2023/08/10 07:55:46,"10188,10214,10256,10751,10761","경상남도 창원시 의창구,경상남도 창원시 성산구,경상남도 창원시 마산합포구,경상남도 창원시 마산회원구,경상남도 창원시 진해구",202420,많은 비로 하천범람 및 도로가 침수되고 있으니 위험지역에 접근을 금지하여 주시기 바라며 외출 자제 및 차량운행에 주의하여 주시기 바랍니다.,cbs,창원시,,,"[('하천범람 도로가 침수되고', 0.7001)]"
2023/08/10 07:45:22,"10188,10214,10256,10751,10761","경상남도 창원시 의창구,경상남도 창원시 성산구,경상남도 창원시 마산합포구,경상남도 창원시 마산회원구,경상남도 창원시 진해구",202400,창원대로 침수로 인하여 통행이 위험하오니 안전을 위하여 우회하여 주시기 바랍니다.,cbs,창원시,,,"[('안전을 위하여', 0.6045)]"
2023/08/10 07:23:55,"10188,10214,10256,10751,10761","경상남도 창원시 의창구,경상남도 창원시 성산구,경상남도 창원시 마산합포구,경상남도 창원시 마산회원구,경상남도 창원시 진해구",202371,의창구 소재 지하차도 양방향 차량 통행금지...안전을 위하여 우회하여 주시기 바랍니다.,cbs,창원시,,,"[('우회하여 주시기 바랍니다', 0.6746)]"
2023/08/10 07:09:45,"10188,10214,10256,10751,10761","경상남도 창원시 의창구,경상남도 창원시 성산구,경상남도 창원시 마산합포구,경상남도 창원시 마산회원구,경상남도 창원시 진해구",202353,"태풍 남해안 근접 중, 많은 비와 함께 강풍이 예상되오니 논둑물꼬 확인금지, 침수도로, 지하차도 등 침수가 예상되는 위험지역에 접근을 금지하여 주세요",cbs,창원시,,,"[('함께 강풍이 예상되오니 논둑물꼬', 0.6542)]"
2023/08/09 17:27:44,"10188,10214,10256,10751,10761","경상남도 창원시 의창구,경상남도 창원시 성산구,경상남도 창원시 마산합포구,경상남도 창원시 마산회원구,경상남도 창원시 진해구",202122,"창원지역에 태풍주의보 발효. 외출을 자제해 주시고 바람에 날아갈 수 있는 간판, 화분 고정 및 생활쓰레기 배출자제 바랍니다.",cbs,창원시,,,"[('발효 외출을 자제해', 0.5003)]"
2023/08/03 22:13:13,"10190,10191,10192,10194,10195,10203,10210,10752,10757","경상남도 창원시 의창구,경상남도 창원시 의창구,경상남도 창원시 의창구,경상남도 창원시 의창구,경상남도 창원시 의창구,경상남도 창원시 의창구,경상남도 창원시 의창구,경상남도 창원시 마산회원구,경상남도 창원시 마산회원구",200983,금일 마산톨게이트 인근에서 발생한 유해가스 유출사고 대응이 완료되어 실내대피 종료. 일상생활 복귀바랍니다.,cbs,창원시,,,"[('유출사고 대응이 완료되어', 0.7335)]"
2023/08/03 19:37:41,"10194,10195","경상남도 창원시 의창구,경상남도 창원시 의창구",200978,"금일 마산톨게이트 부근 황산유출 사고 처리 진행 중, 황산가스가 소계동(천주산) 방면 확산되고 있으니 해당 주민은 창문을 닫고 실내 대기바랍니다.",cbs,창원시,천주산,,"[('방면 확산되고 있으니 해당', 0.7494)]"
2023/08/03 19:33:23,"10190,10191,10192,10194,10195,10203,10210,10752,10757","경상남도 창원시 의창구,경상남도 창원시 의창구,경상남도 창원시 의창구,경상남도 창원시 의창구,경상남도 창원시 의창구,경상남도 창원시 의창구,경상남도 창원시 의창구,경상남도 창원시 마산회원구,경상남도 창원시 마산회원구",200977,남해제1지선 마산톨게이트 부근 탱크로리 황산유출 사고처리가 지연되고 있습니다. 외출을 삼가해 주시고 실내에 머물러 주시기 바랍니다.,cbs,창원시,,,"[('사고처리가 지연되고 있습니다', 0.6954)]"
2023/08/03 17:58:15,"10188,10214,10256,10751,10761","경상남도 창원시 의창구,경상남도 창원시 성산구,경상남도 창원시 마산합포구,경상남도 창원시 마산회원구,경상남도 창원시 진해구",200975,"소계지하차도 양방향 통행이 정상복구 되었으니, 차량 운행에 참고하시기 바랍니다.",cbs,창원시,,,"[('소계지하차도 양방향', 0.3058)]"
2023/08/03 17:24:10,"10188,10214,10256,10751,10761","경상남도 창원시 의창구,경상남도 창원시 성산구,경상남도 창원시 마산합포구,경상남도 창원시 마산회원구,경상남도 창원시 진해구",200972,동마산ic삼거리 고속도로 진입 후 교통통제 중이오니 우회하여 주시기 바랍니다.,cbs,창원시,,,"[('우회하여 주시기', 0.578)]"
2023/08/03 17:00:45,"10188,10214,10256,10751,10761","경상남도 창원시 의창구,경상남도 창원시 성산구,경상남도 창원시 마산합포구,경상남도 창원시 마산회원구,경상남도 창원시 진해구",200968,남해제1지선 마산톨게이트부근 탱크로리 황산유출 사고로 소계지하차도 양방향 교통 통제중이니 우회 등 안전에 유의하여 주시기 바랍니다.,cbs,창원시,,,"[('양방향 교통 통제중이니 우회', 0.6802)]"
2023/08/03 15:06:48,"10189,10191,10192,10194,10195,10203,10210,10752,10757","경상남도 창원시 의창구,경상남도 창원시 의창구,경상남도 창원시 의창구,경상남도 창원시 의창구,경상남도 창원시 의창구,경상남도 창원시 의창구,경상남도 창원시 의창구,경상남도 창원시 마산회원구,경상남도 창원시 마산회원구",200955,금일 남해고속도로 1지선 마산톨게이트 부근 탱크로리 황산유출로 인하여 현재 조치중. 상황종료시까지 인근주민들께서는 외출자제 및 창문을 닫고 실내대기,cbs,창원시,,,"[('1지선 마산톨게이트 부근', 0.6953)]"
2023/08/03 13:55:03,"10189,10191,10192,10194,10195,10203,10210,10752,10757","경상남도 창원시 의창구,경상남도 창원시 의창구,경상남도 창원시 의창구,경상남도 창원시 의창구,경상남도 창원시 의창구,경상남도 창원시 의창구,경상남도 창원시 의창구,경상남도 창원시 마산회원구,경상남도 창원시 마산회원구",200921,"금일12시30분경 동마산톨케이트 인근 황산가스 탱크로리 가스 누출 발생. 인근 주민께서는 창문을 닫고 외출자제, 다음 안내까지 실내 대기바랍니다",cbs,창원시,,,"[('발생 인근 주민께서는', 0.6785)]"
2023/08/03 12:59:40,"10195,10210,10752","경상남도 창원시 의창구,경상남도 창원시 의창구,경상남도 창원시 마산회원구",200902,"마산톨게이트 인근 탱크로리 유독가스 유출확인. 소계동, 팔용동, 구암동 주민께서는 외출을 자제해 주시기 바랍니다.",cbs,창원시,,,"[('소계동 팔용동', 0.6469)]"
2023/07/18 15:25:29,"10188,10214,10256,10751,10761","경상남도 창원시 의창구,경상남도 창원시 성산구,경상남도 창원시 마산합포구,경상남도 창원시 마산회원구,경상남도 창원시 진해구",198700,"내일 새벽까지 창원시 전역에 많은 비가 예상됩니다. 계곡, 하천변, 저지대 등 침수위험이 있는 지역은 접근을 금지하여 주시고 가급적 외출을 자제해주세요",cbs,창원시,,,"[('새벽까지 창원시 전역에', 0.7505)]"
2023/07/15 22:29:35,"10188,10214,10256,10751,10761","경상남도 창원시 의창구,경상남도 창원시 성산구,경상남도 창원시 마산합포구,경상남도 창원시 마산회원구,경상남도 창원시 진해구",198121,"밤사이 강한 비가 예상되오니, 지하공간,하천변에 주의하시고, 야영장,비탈면 인접 거주민들은 안전한 곳으로 대피하여 주시고, 야간 외출을 자제하여 주세요.",cbs,창원시,,,"[('지하공간 하천변에', 0.7514)]"
2023/07/14 13:30:58,"10231,10232,10234,10235,10236,10237,10257,10264,10265,10266,10269,10271,10284,10717,10720,10721,10722,10724,10727,10744,10745,10766,10767","경상남도 창원시 성산구,경상남도 창원시 성산구,경상남도 창원시 성산구,경상남도 창원시 성산구,경상남도 창원시 성산구,경상남도 창원시 성산구,경상남도 창원시 마산합포구,경상남도 창원시 마산합포구,경상남도 창원시 마산합포구,경상남도 창원시 마산합포구,경상남도 창원시 마산합포구,경상남도 창원시 마산합포구,경상남도 창원시 마산합포구,경상남도 창원시 마산합포구,경상남도 창원시 마산합포구,경상남도 창원시 마산합포구,경상남도 창원시 마산합포구,경상남도 창원시 마산합포구,경상남도 창원시 마산합포구,경상남도 창원시 마산합포구,경상남도 창원시 마산합포구,경상남도 창원시 진해구,경상남도 창원시 진해구",197411,마창대교에서 가포신항 방면 램프 구간 토사유출로 인해 응급복구 작업중으로 차량 통행 재개 예정시간(17:00)까지 우회하여 주시기 바랍니다.,cbs,창원시,17:00,,"[('작업중으로 차량 통행', 0.6276)]"
2023/07/14 10:00:24,"10217,10218,10219,10220,10222,10223,10224,10225,10226,10227,10228,10229,10231,10232,10234,10235,10236,10237,10241,10242,10243,10245,10246,10247,10257,10266,10766,10767,10799,10800","경상남도 창원시 성산구,경상남도 창원시 성산구,경상남도 창원시 성산구,경상남도 창원시 성산구,경상남도 창원시 성산구,경상남도 창원시 성산구,경상남도 창원시 성산구,경상남도 창원시 성산구,경상남도 창원시 성산구,경상남도 창원시 성산구,경상남도 창원시 성산구,경상남도 창원시 성산구,경상남도 창원시 성산구,경상남도 창원시 성산구,경상남도 창원시 성산구,경상남도 창원시 성산구,경상남도 창원시 성산구,경상남도 창원시 성산구,경상남도 창원시 성산구,경상남도 창원시 성산구,경상남도 창원시 성산구,경상남도 창원시 성산구,경상남도 창원시 성산구,경상남도 창원시 성산구,경상남도 창원시 마산합포구,경상남도 창원시 마산합포구,경상남도 창원시 진해구,경상남도 창원시 진해구,경상남도 창원시 진해구,경상남도 창원시 진해구",197348,마창대교에서 가포신항 방면 램프 구간 토사 유출로 인한 차로 전면 통제 중이오니 우회하여 주세요,cbs,창원시,,,"[('유출로 인한', 0.6408)]"
2023/04/23 19:04:19,68,경상남도 창원시,194637,황사 위기경보(주의)가 해제됨을 알려드립니다. 야외활동에 참고바랍니다.,cbs,창원시,주의,,"[('위기경보 주의 해제됨을', 0.4972)]"
2023/04/21 21:19:01,68,경상남도 창원시,194588,"창원시 황사 위기경보(주의) 발령. 출입문 등을 닫아 황사 실내 유입 차단하고, 어린이, 노약자 야외활동 자제, 야외에서 보건용 마스크 착용 바랍니다.",cbs,창원시,주의,,"[('황사 위기경보 주의', 0.6687)]"
2012/04/03 05:06:48,"6407,6408,6409,6410,6411","경상남도 창원시 진해구,경상남도 창원시 마산합포구",193,3일 03시 10분 창원지 역 호우주의보 발 효. 비 피해 없도 록 안전에 주의하 세요,cbs,창원시,,,"[('3일 03시', 0.5362)]"
