2020/09/01 15:22:58,94,경상북도 청도군,52399,"청도읍 코로나19 확진자 이송완료 및 동거가족 3명 추가 검사 결과 모두 음성이며 해당 확진자는 자가격리 중 확진, 그 외 추가 접촉자는 없습니다.",cbs,청도군청,,,"[('이송완료 동거가족 3명 추가', 0.7036)]"
2020/09/01 10:38:58,94,경상북도 청도군,52271,경산 학습지 교사 관련 접촉자 중 금일 청도읍 확진자 1명 발생. 소독완료. 자가격리 중 확진으로 타 접촉자 발생 없으며 금일 중 병원 이송 예정.,cbs,청도군청,,,"[('확진자 1명 발생', 0.7516)]"
2020/08/30 18:02:20,94,경상북도 청도군,51843,접촉자 파악 및 방역조치 완료된 곳은 감염의 우려가 없으므로 상호 및 장소 등 상세한 정보를 공개하지 않는 점 양해바랍니다.,cbs,청도군청,,,"[('방역조치 완료된', 0.6679)]"
2020/08/30 17:58:58,94,경상북도 청도군,51841,울산84번이 방문한 관내 카페 소독완료 및 접촉자2명 검사완료. 현재 자가격리중임을 알려드립니다.,cbs,청도군청,,,"[('소독완료 접촉자2명', 0.6113)]"
2020/08/21 21:27:56,94,경상북도 청도군,47567,광화문 집회 개별 참석자 또는 주변에 참석자를 아시는 분은 검사를 받을 수 있도록 적극 권유 바랍니다.,cbs,청도군청,,,"[('참석자 또는 주변에', 0.6941)]"
2020/08/21 21:21:25,94,경상북도 청도군,47566,OO교회 및 광화문집회 확진 각 1명외 접촉자 55명과 학습지교사 접촉자33명 모두 음성. 우리 군민 모두 마음을 함께하여 코로나 재확산을 막아냅시다,cbs,청도군청,,,"[('우리 군민 모두', 0.6576)]"
2020/08/19 15:25:34,94,경상북도 청도군,46413,8월19일 코로나19 확진자 2명 발생. 환자 입원 조치 및 소독완료. 코로나19 확산방지를 위해 마스크 착용 등 생활방역수칙을 준수하시기 바랍니다.,cbs,청도군청,,,"[('환자 입원 조치', 0.6514)]"
2020/08/10 07:55:39,94,경상북도 청도군,43725,"태풍'장미'영향으로 강풍을 동반한 많은 비가 예상되니 하천, 저지대, 산사태 등 위험지역 접근금지, 외출 및 차량운행 자제 등 안전에 유의바랍니다.",cbs,청도군청,,,"[('장미 영향으로', 0.7151)]"
2020/08/08 13:07:24,94,경상북도 청도군,43165,"기록적 폭우로 산사태 위기경보 ""심각""상황발령. 산사태 피해 우려지역 주민들은 유사 시 안전한 곳으로 신속히 대피하여 안전에 유의바랍니다.",cbs,청도군청,,,"[('상황발령 산사태', 0.744)]"
2020/08/07 18:04:56,94,경상북도 청도군,42790,"집중호우로 인해 산사태 발생우려가 높으니, 입산금지 바라며 산림 인접 거주자는 안전에 유의하시길 바랍니다.",cbs,청도군청,,,"[('입산금지 바라며 산림', 0.7175)]"
2020/05/09 13:43:01,94,경상북도 청도군,34770,"청도군민 중 4.30.~5.5.까지 이태원 클럽(킹,퀸,트렁크,소호)방문자는 즉시 보건소로 연락하시기 바랍니다.054-370-2696",cbs,청도군청,"킹,퀸,트렁크,소호",,"[('연락하시기 바랍니다', 0.6197)]"
2020/03/05 11:31:03,94,경상북도 청도군,28698,코로나 의심 증상시 치매안심센터 선별진료소에서 진료바랍니다. 운영시간은 09시~18시입니다. 문의는 청도보건소 나 1339,cbs,청도군청,,,"[('선별진료소에서 진료바랍니다 운영시간은', 0.6436)]"
2020/03/04 14:43:11,94,경상북도 청도군,28529,3.3(화) 주민 확진자 1명 추가. 의심 증상시 치매안심센터 선별진료소에서 진료 요망 08~22시.신분증 필.1339 또는 370-6470,cbs,청도군청,화,,"[('선별진료소에서 진료 요망 08', 0.474)]"
2020/03/03 15:47:05,94,경상북도 청도군,28380,"대남병원 확진자 2명이송, 31명 이송대중, 의심 증상시 치매안심센터 선별진료소에서 진료 요망 08~22시.신분증 필.1339 또는 370-6470",cbs,청도군청,,,"[('의심 증상시 치매안심센터 선별진료소에서', 0.5657)]"
2020/03/03 14:49:14,94,경상북도 청도군,28363,3. 4(수)부터는 관내 우체국 및 농협에서 같은시각(오전 11시)에 마스크 판매 시작 예정입니다.370-6328,cbs,청도군청,수,,"[('시작 예정입니다 370 6328', 0.4323)]"
2020/03/03 09:59:44,94,경상북도 청도군,28281,3.2(월)추가확진자 없음.의심 증상시 치매안심센터 선별진료소에서 진료 요망 08~22시.신분증 필.1339 또는 370-6470,cbs,청도군청,월,,"[('증상시 치매안심센터', 0.4814)]"
2020/03/02 15:47:11,94,경상북도 청도군,28124,어제 대남병원 확진자 2명 김천의료원 이송. 현 33명 이송 준비 중. 기타사항은 청도군 홈페이지를 참고하시기 바랍니다. 370-2315,cbs,청도군청,,,"[('청도군 홈페이지를 참고하시기', 0.6132)]"
2020/03/02 11:24:49,94,경상북도 청도군,28050,화양보건지소 선별진료소 일시 중지.의심 증상시 치매안심센터 선별진료소에서 진료받으시길 바랍니다. 08~22시. 신분증 필.1339 또는 370-6470,cbs,청도군청,,,"[('치매안심센터 선별진료소에서 진료받으시길 바랍니다', 0.6512)]"
2020/03/01 22:23:23,94,경상북도 청도군,27995,화양보건지소 선별진료소 일시 중지.의심 증상시 치매안심센터 선별진료소에서 진료받으시길 바랍니다. 08~22시. 신분증 필.1339 또는 370-6470,cbs,청도군청,,,"[('치매안심센터 선별진료소에서 진료받으시길 바랍니다', 0.6512)]"
2020/03/01 17:37:39,94,경상북도 청도군,27940,코로나19 의심증상 발생시 청도군보건소 또는 국번없이 1339로 먼저 연락하시기 바랍니다.370-6470,cbs,청도군청,,,"[('발생시 청도군보건소 또는 국번없이', 0.4984)]"
2020/02/29 17:40:41,94,경상북도 청도군,27604,"29일 현재, 대남병원 격리환자 중 이송 60명, 사망7, 이송대기중 35명 370-2315",cbs,청도군청,,,"[('사망7 이송대기중', 0.5152)]"
2020/02/29 10:17:57,94,경상북도 청도군,27396,"치매안심센터,화양읍보건지소 내 선별진료소 운영. 의심 증상시 진료 받으시길 바랍니다.08~22시 운영. 신분증 지참. 1339 또는 370-2674",cbs,청도군청,,,"[('증상시 진료 받으시길', 0.6664)]"
2020/02/28 09:31:41,94,경상북도 청도군,27101,"치매안심센터, 화양읍보건소 내 선별진료소 운영. 기침, 발열 등 의심 증상 시 진료받으시길 바랍니다.08~22시 운영. 1339 또는 370-2674",cbs,청도군청,,,"[('22시 운영', 0.6548)]"
2020/02/27 08:56:12,94,경상북도 청도군,26837,"치매안심센터, 화양읍보건소 내 선별진료소 운영. 기침, 발열 등 의심 증상 시 진료받으시길 바랍니다. 08~22시 운영 1339 또는 370-2674",cbs,청도군청,,,"[('의심 증상 진료받으시길', 0.6389)]"
2020/02/26 15:57:34,94,경상북도 청도군,26691,"치매안심센터, 화양읍보건소 내 선별진료소 운영. 기침, 발열 등 의심 증상 시 진료받으시길 바랍니다. 08~22시 운영 1339 또는 370-2674",cbs,청도군청,,,"[('의심 증상 진료받으시길', 0.6389)]"
2020/02/26 12:30:12,94,경상북도 청도군,26638,"치매안심센터, 화양읍보건소 내 선별진료소 운영. 기침, 발열 등 의심 증상 시 진료받으시길 바랍니다. 1339 또는 370-2674",cbs,청도군청,,,"[('화양읍보건소 선별진료소', 0.6084)]"
2020/02/25 10:55:47,94,경상북도 청도군,26295,"치매안심센터, 화양읍보건지소 내 선별진료소 운영. 기침, 발열 등 의심 증상 시 진료받으시길 바랍니다. 1339 또는 370-2674",cbs,청도군청,,,"[('화양읍보건지소 선별진료소', 0.6084)]"
2020/02/23 11:51:17,94,경상북도 청도군,25785,"치매안심센터 및 화양보건지소 내 코로나19 선별진료소 운영. 발열, 호흡기 의심 증상시 검사 받으시기바랍니다. 1339 또는 370-2674",cbs,청도군청,,,"[('증상시 검사 받으시기바랍니다', 0.615)]"
2020/02/22 12:13:44,94,경상북도 청도군,25644,2월 1일 이후 대남병원 및 요양원 방문자는 발열 등 의심 증상 시 치매안심센터 선별진료소에서 진료바랍니다.370-2695,cbs,청도군청,,,"[('증상 치매안심센터 선별진료소에서', 0.6309)]"
2020/02/20 14:51:02,94,경상북도 청도군,25460,2. 20. 대남병원 환자2명 코로나19 확진판정. 개인위생 철저 및 의심증상 발생 시 청도군보건소나 1339로 문의바랍니다. 370-2695,cbs,청도군청,,,"[('문의바랍니다 370', 0.6459)]"
2018/02/22 17:04:59,94,경상북도 청도군,3424,"청도군 운문면 마일리 산364번지 산불발생, 주민과 등산객은 안전한 곳으로 즉시 대피 바랍니다.",cbs,청도군청,,,"[('산불발생 주민과', 0.6861)]"
2017/06/22 10:24:36,94,경상북도 청도군,2522,"4월10일 이후 전통시장등에서 살아있는 닭,오리를 구입하여 키우거나 폐사한 경우 농정과(370-6534)로 신고바랍니다",cbs,청도군청,370-6534,,"[('전통시장등에서 살아있는', 0.5846)]"
