create_date,location_id,location_name,md101_sn,msg,send_platform,cast,missing,age,keyword
2023/11/23 21:06:58,52,경기도 화성시,206957,"경진여객 광역버스 11. 24.(금) 16시 이후 파업 예정으로 대체수단 이용 권장, 버스정보시스템 및 시홈페이지 참고",cbs,화성시,금,,"[('대체수단 이용 권장', 0.5694)]"
2023/11/23 17:19:03,52,경기도 화성시,206928,"23일 (목) 21시부터 주말까지 영하권 지속, 수도관 동파 예방 조치, 농작물 냉해피해 예방조치, 취약계층(독거노인 등) 외출 자제 및 안전수칙 준수",cbs,화성시,목,,"[('안전수칙 준수', 0.5881)]"
2023/11/21 21:00:06,52,경기도 화성시,206902,경진여객 광역버스 전 노선 11. 22.(수) 총 파업. 대체수단 이용 권장.(홈페이지 참고: https://url.kr/at4oxs),cbs,화성시,수,,"[('권장 홈페이지', 0.4694)]"
2023/11/19 18:00:13,52,경기도 화성시,206877,경진여객 광역버스 11. 20.(월) 출근 시간대 게릴라성 파업 예정으로 대체수단 이용 권장,cbs,화성시,월,,"[('이용 권장', 0.58)]"
2023/11/17 18:29:13,52,경기도 화성시,206791,"금일 저녁 강설 후 급격한 기온 하락이 예상되오니, 저녁 퇴근길 및 내일 새벽 도로주행 시 서행운전 및 안전거리를 확보하여 도로결빙 미끄럼 사고에 유의",cbs,화성시,,,"[('서행운전 안전거리를', 0.7548)]"
2023/11/16 22:43:49,52,경기도 화성시,206759,경진여객 광역버스 11.17.(금) 출근 시간대 게릴라성 파업 예정으로 대체수단 이용 권장,cbs,화성시,금,,"[('게릴라성 파업', 0.6182)]"
2023/11/15 11:15:17,52,경기도 화성시,206730,경진여객 광역버스 11.15.(수) 퇴근 시간대 게릴라성 파업 예정으로 대체수단 이용 권장,cbs,화성시,수,,"[('예정으로 대체수단 이용', 0.565)]"
2023/11/14 07:06:51,52,경기도 화성시,206711,경진여객 광역버스 11.14(화) 게릴라성 파업으로 출퇴근 시간대 대체수단 이용 권장,cbs,화성시,화,,"[('대체수단 이용', 0.5949)]"
2023/11/06 08:21:19,52,경기도 화성시,206518,"강풍·풍랑 경보 발효, 간판, 부착물 고정, 선박 결박, 비닐하우스 등 시설물 피해에 대비 바라며,해안 및 위험지역 접근금지 등 안전에 유의 바랍니다.",cbs,화성시,,,"[('바라며 해안 위험지역 접근금지', 0.6096)]"
2023/11/05 15:12:18,52,경기도 화성시,206459,"오늘 밤, 이른 새벽 많은 비와 강풍 예보. 하천변 산책로, 산사태 취약 지역 등 위험지역에 접근하지 마시고, 간판, 낙하물 등 안전사고에 주의바랍니다.",cbs,화성시,,,"[('위험지역에 접근하지 마시고 간판', 0.6608)]"
2023/09/22 10:50:33,52,경기도 화성시,205638,"9.22.(금) 19:30 화성종합경기타운에서 대규모 행사 진행 예정, 주변도로 교통혼잡이 예상되오니 대중교통 이용 및 차량 우회하여 주시기 바랍니다.",cbs,화성시,금,,"[('주변도로 교통혼잡이', 0.4808)]"
2023/08/25 18:49:50,52,경기도 화성시,204459,향남읍 구문천리 화재현장에서 유독연기 발생가능성이 있습니다. 구문천리 주민분들은 창문을닫고 에어컨중지후 실내대기/외출자제바랍니다.031-5189-2119,cbs,화성시,,,"[('창문을닫고 에어컨중지후', 0.7198)]"
2023/08/25 14:48:54,52,경기도 화성시,204455,"서해안고속도로 향남 졸음쉼터 부근 2km 양방향(서울,목포) 통제해제하오니 이용에 참고하시기 바랍니다.",cbs,화성시,"서울,목포",,"[('양방향 서울 목포', 0.5272)]"
2023/08/25 12:51:59,52,경기도 화성시,204446,"화재로 인해 서해안고속도로 향남졸음쉼터 부근 2km 양방향 전면 통제하니 우회바랍니다(서울방향 청북IC,서평택IC 이용/목포방향 발안IC,비봉IC 이용)",cbs,화성시,"서울방향 청북IC,서평택IC 이용/목포방향 발안IC,비봉IC 이용",,"[('향남졸음쉼터 부근 2km 양방향', 0.5834)]"
2023/08/25 11:59:44,52,경기도 화성시,204445,"오늘11:12경 화성시 향남읍 구문천리 폐기물업체 화재발생, 이 지역을 우회하여 주시고 인근주민 및 서해안고속도로 통행자는 안전사고 발생에 유의바랍니다.",cbs,화성시,,,"[('통행자는 안전사고', 0.6283)]"
2023/08/23 14:36:44,52,경기도 화성시,204217,"호우주의보 발효중.하천변 산책로, 산사태 및 침수우려지역, 급경사지 등 위험지역 접근 금지/반지하, 비탈면 인근 주민은 안전에 유의하여 주시기 바랍니다.",cbs,화성시,,,"[('호우주의보 발효중', 0.6917)]"
2023/08/21 14:17:13,52,경기도 화성시,203908,"폭염주의보 발효 중,무더위가 심한 낮시간대(14~17시)에는 야외활동을 자제하여 주시고 폭염안전수칙(물,그늘,휴식)을 준수하여 건강관리에 유의바랍니다.",cbs,화성시,14~17시,,"[('폭염주의보 발효', 0.672)]"
2023/08/20 14:17:04,52,경기도 화성시,203797,"폭염주의보 발효 중,무더위가 심한 낮시간대(14~17시)에는 야외활동을 자제하여 주시고 폭염안전수칙(물,그늘,휴식)을 준수하여 건강관리에 유의바랍니다.",cbs,화성시,14~17시,,"[('폭염주의보 발효', 0.672)]"
2023/08/20 11:10:46,52,경기도 화성시,203761,"현재 화성시 전역 폭염주의보 발효 중, 낮시간대 야외·농업활동,실외작업 등을 자제하고 폭염안전수칙(물,그늘,휴식)을 준수하여 건강에 유의하시기 바랍니다.",cbs,화성시,"물,그늘,휴식",,"[('휴식 준수하여 건강에 유의하시기', 0.6968)]"
2023/08/19 14:20:57,52,경기도 화성시,203712,"폭염주의보 지속중,온열질환 발생가능성이 높은 낮시간(14~17시)에는 야외활동 자제해 주시고 폭염안전수칙(물,그늘,휴식)을 지켜 건강관리에 유의바랍니다.",cbs,화성시,14~17시,,"[('폭염주의보 지속중', 0.586)]"
2023/08/19 10:59:25,52,경기도 화성시,203678,"현재 폭염주의보 지속 중, 야외 작업 및 논밭작업을 자제하여 주시고 온열질환이 발생하지 않도록 폭염 안전수칙(물,그늘,휴식)을 준수하여 주시기 바랍니다.",cbs,화성시,"물,그늘,휴식",,"[('자제하여 주시고 온열질환이', 0.7109)]"
2023/08/18 12:21:38,52,경기도 화성시,203606,"폭염주의보 발효중, 낮시간 농축어업 종사자,건설현장 근로자분들께서는 야외활동 자제하여 주시고 폭염안전수칙(물,그늘,휴식)을 준수하여 건강에 유의바랍니다.",cbs,화성시,"물,그늘,휴식",,"[('농축어업 종사자 건설현장', 0.721)]"
2023/08/15 10:56:14,52,경기도 화성시,203317,"폭염주의보 발효 중, 옥외노동자 및 농.축.어업인분들께서는 장시간 야외활동을 자제하여 주시고 충분한 수분섭취와 실내 휴식을 통해 건강에 유의바랍니다.",cbs,화성시,,,"[('발효 옥외노동자 어업인분들께서는 장시간', 0.6897)]"
2023/08/14 11:29:45,52,경기도 화성시,203228,"폭염주의보 발효 중, 실외작업자 및 논밭작업자는 무리한 야외활동을 자제하여 주시고, 충분한 수분섭취, 휴식을 취하시어 건강관리에 유의하시기 바랍니다.",cbs,화성시,,,"[('무리한 야외활동을 자제하여', 0.7199)]"
2023/08/13 11:44:47,52,경기도 화성시,203137,"폭염주의보 발효 중, 실외 작업 및 논밭작업 등 야외활동을 자제하여주시고 폭염 안전수칙(물,그늘,휴식) 지키기 등 건강에 유의바랍니다.",cbs,화성시,"물,그늘,휴식",,"[('그늘 휴식 지키기', 0.7174)]"
2023/08/10 19:32:21,52,경기도 화성시,203001,"태풍주의보 발효 중, 강풍에 대비하여 아파트, 주택 등 창문고정, 옥외 입간판 점검, 외출자제 등 안전에 유의하여 주시기 바랍니다(vo.la/DIcLC)",cbs,화성시,vo.la/DIcLC,,"[('아파트 주택 창문고정 옥외', 0.5591)]"
2023/08/10 06:52:02,52,경기도 화성시,202331,"태풍 주의보 발효예정,출근길 대중교통이용,급경사지,비탈면,하천변,해안가 등 위험지역 접근 금지,논밭 관리행위 금지, 외출 자제, 안전에 주의 바랍니다.",cbs,화성시,,,"[('해안가 위험지역 접근 금지', 0.6715)]"
2023/08/09 15:52:53,52,경기도 화성시,202049,"태풍(카눈)이 북상함에 따라 강풍과 많은 비가 예상되므로 하천 산책로 출입을 자제하여 주시고 간판, 화분 등이 날아가지 않도록 실내로 이동 바랍니다.",cbs,화성시,카눈,,"[('강풍과 많은', 0.6649)]"
2023/08/09 11:28:43,52,경기도 화성시,201926,"현재 폭염주의보 발효중으로 논밭작업자 및 옥외노동자 등은 야외활동 자제, 충분한 수분섭취와 그늘 휴식 등 폭염안전수칙을 준수하여 건강에 유의바랍니다.",cbs,화성시,,,"[('현재 폭염주의보', 0.7175)]"
2023/08/08 15:13:33,52,경기도 화성시,201779,"현재 폭염경보 발효 중, 낮시간 야외활동(영농활동, 공사장 작업 등) 자제, 충분한 수분섭취와 휴식으로 건강에 유의 바랍니다.",cbs,화성시,"영농활동, 공사장 작업 등",,"[('야외활동 영농활동 공사장', 0.6058)]"
2023/08/07 20:31:13,52,경기도 화성시,201655,"현재 호우주의보 발효중. 많은 비가 예상되오니 하천변 산책로, 산사태 우려지역 등 접근 자제 및 지하차도, 반지하주택 등 안전에 유의하여 주시기 바랍니다",cbs,화성시,,,"[('자제 지하차도 반지하주택 안전에', 0.7661)]"
2023/08/07 15:38:20,52,경기도 화성시,201623,"폭염경보가 지속됨에 따라 관내 온열환자 지속발생, 야외활동자제, 충분한 수분섭취, 실외작업자 휴식 등 안전에 유의바랍니다.",cbs,화성시,,,"[('지속발생 야외활동자제', 0.6446)]"
2023/08/07 11:58:18,52,경기도 화성시,201564,"폭염경보 발효중. 폭염집중시간(14~17시) 야외활동 자제,논밭작업자, 옥외근로자등 야외 활동시 수분섭취, 그늘휴식 통해 개인 건강관리에 유의바랍니다.",cbs,화성시,14~17시,,"[('발효중 폭염집중시간 14', 0.6242)]"
2023/08/06 15:27:59,52,경기도 화성시,201478,"폭염경보 발효 중. 무더위 시간대(14시~17시) 영농활동을 자제하시고, 실외작업장 폭염 안전수칙(물, 그늘, 휴식) 지키기 등 건강에 유의바랍니다.",cbs,화성시,14시~17시,,"[('그늘 휴식 지키기', 0.6495)]"
2023/08/06 12:58:19,52,경기도 화성시,201420,"현재 폭염경보 발효 중. 낮 시간 야외활동(영농활동, 공사장 작업 등)을 자제하시고 무더위 쉼터 이용, 충분한 수분섭취 등 건강관리에 유의바랍니다.",cbs,화성시,"영농활동, 공사장 작업 등",,"[('영농활동 공사장', 0.6106)]"
2023/08/05 10:33:42,52,경기도 화성시,201185,"현재 폭염경보 발효 중. 낮 시간 야외활동(영농활동, 공사장 작업 등)을 자제하시고 무더위 쉼터 이용, 충분한 수분섭취 등 건강관리에 유의바랍니다.",cbs,화성시,"영농활동, 공사장 작업 등",,"[('영농활동 공사장', 0.6106)]"
2023/08/04 14:06:39,52,경기도 화성시,201082,"현재 폭염경보 발효 중. 온열환자 지속발생 중으로 낮 시간 야외활동 자제, 충분한 수분섭취, 무더위 쉼터 이용으로 온열질환에 유의하여 주시기 바랍니다.",cbs,화성시,,,"[('현재 폭염경보 발효', 0.7511)]"
2023/08/04 12:00:20,52,경기도 화성시,201046,"연일 폭염경보 지속 중. ▲무리한 야외활동(논, 밭, 공사장 등) 자제▲특히 1인 작업 매우 위험▲충분한 물 마시기▲폭염 안전 수칙을 준수하기",cbs,화성시,"논, 밭, 공사장 등",,"[('자제 특히 1인', 0.6238)]"
2023/08/03 14:47:10,52,경기도 화성시,200949,"현재 폭염 경보 발효 중. 농,축,어업인 및 옥외 노동자 야외 작업 자제, 폭염 안전수칙(물, 그늘, 휴식) 지키기 등 온열질환 발생에 유의 바랍니다.",cbs,화성시,"물, 그늘, 휴식",,"[('야외 작업 자제 폭염', 0.6392)]"
2023/08/03 11:20:17,52,경기도 화성시,200881,폭염경보 발효 중. 폭염대비 건강관리 안전수칙을 꼭 지켜주시기 바랍니다. ▲시원하게 지내기 ▲물 자주 마시기 ▲무더운시간대(14시~17시)활동자제하기,cbs,화성시,14시~17시,,"[('폭염대비 건강관리', 0.7233)]"
2023/08/02 14:53:29,52,경기도 화성시,200803,"폭염 경보 발효 중(최고기온 34도)▲농,축,어업인 및 옥외 노동자 야외 작업 자제▲폭염 안전수칙(물, 그늘, 휴식) 지키기▲폭염 취약계층 안부 전화하기",cbs,화성시,최고기온 34도,,"[('노동자 야외 작업 자제', 0.7317)]"
2023/08/02 11:44:16,52,경기도 화성시,200755,"현재 폭염경보 발효중. 낮 시간 야외활동(영농활동, 공사장 작업 등) 자제, 충분한 수분섭취, 무더위 쉼터 이용으로 온열질환에 유의하여 주시기 바랍니다.",cbs,화성시,"영농활동, 공사장 작업 등",,"[('충분한 수분섭취 무더위', 0.6378)]"
2023/08/01 14:06:59,52,경기도 화성시,200650,"현재 폭염경보 발효중. 낮 시간 야외활동(논,밭,공사장 등)자제, 충분한 수분섭취, 무더위 쉼터 이용으로 온열질환에 유의하여 주시기 바랍니다.",cbs,화성시,"논,밭,공사장 등",,"[('자제 충분한', 0.6562)]"
2023/08/01 11:00:49,52,경기도 화성시,200598,"폭염경보 발효중. 14시~17시 사이 야외활동(영농활동, 공사장 작업 등)을 자제하시고 무더위 쉼터 이용, 충분한 수분섭취 등 건강관리에 유의바랍니다.",cbs,화성시,"영농활동, 공사장 작업 등",,"[('폭염경보 발효중 14시 17시', 0.6529)]"
2023/07/31 14:59:03,52,경기도 화성시,200509,"현재 폭염 경보 발효 중. 농,축,어업인 및 옥외 노동자 야외 작업 자제, 폭염 안전수칙(물, 그늘, 휴식) 지키기 등 온열질환 발생에 유의 바랍니다.",cbs,화성시,"물, 그늘, 휴식",,"[('야외 작업 자제 폭염', 0.6392)]"
2023/07/30 17:01:37,52,경기도 화성시,200361,"현재 호우주의보 발효중,하천변 산책로,산사태우려지역 등 위험지역에 접근을 금하여 주시고 특히 동부권역에 강한 국지성 호우가 예상되니 안전에 유의바랍니다.",cbs,화성시,,,"[('주시고 특히 동부권역에 강한', 0.7349)]"
2023/07/30 14:00:52,52,경기도 화성시,200334,"폭염 경보 발효 중. 무더운 시간대(14시~17시) 야외활동 자제, 물 충분히 마시기, 충분한 휴식 취하기 등 건강관리에 유의바랍니다.",cbs,화성시,14시~17시,,"[('발효 무더운', 0.6893)]"
2023/07/30 09:45:43,52,경기도 화성시,200230,"폭염 경보 발효 중. 농,축,어업인 및 옥외 노동자 야외 작업 자제, 폭염 안전수칙(물, 그늘, 휴식) 지키기 등 온열질환 발생에 유의 바랍니다.",cbs,화성시,"물, 그늘, 휴식",,"[('노동자 야외 작업 자제', 0.6555)]"
2023/07/28 14:15:13,52,경기도 화성시,200064,"폭염 경보 발효 중(최고기온 34도)▲낮 시간대 야외활동자제(논, 밭, 공사장 등)▲폭염 안전수칙(물, 그늘, 휴식) 지키기▲폭염 취약계층 안부 전화하기",cbs,화성시,최고기온 34도,,"[('폭염 경보', 0.6919)]"
2023/07/28 11:34:47,52,경기도 화성시,200048,"폭염 경보 발효 중. 야외활동(▲농작업▲비닐하우스▲공사장 등)자제, 충분한 수분섭취와 폭염 안전수칙 지키기 등 안전관리에 유의바랍니다.",cbs,화성시,▲농작업▲비닐하우스▲공사장 등,,"[('발효 야외활동 농작업', 0.7245)]"
2023/07/27 11:41:41,52,경기도 화성시,199957,"폭염주의보 발효중, 폭염 집중시간(14~17시) 야외활동 자제,실외작업장(공사장,논·밭등) 폭염 안전수칙(물,그늘,휴식) 지키기 등 안전에 유의바랍니다.",cbs,화성시,14~17시,,"[('야외활동 자제 실외작업장 공사장', 0.6602)]"
2023/07/22 19:04:40,52,경기도 화성시,199369,"23일 새벽 집중호우가 예상되오니 해안가 야영장 등 위험지역 방문객, 반지하, 하천변 저지대, 산사태위험지역 인근 주민은 각별히 주의하여 주시기 바랍니다",cbs,화성시,,,"[('방문객 반지하', 0.6936)]"
2023/07/22 17:07:17,52,경기도 화성시,199346,"주말동안 많은 비가 예상됨에 따라 우리시 하천변 산책로, 세월교, 둔치주차장 출입을 통제 중이니 출입을 금하여 주시기 바랍니다.",cbs,화성시,,,"[('통제 중이니 출입을', 0.7137)]"
2023/07/22 10:31:03,52,경기도 화성시,199274,"현재 폭염주의보 발효 중, 야외활동을 자제하여 주시고 논,밭,건설현장 내 근무자분들은 충분한 수분 섭취, 휴식 등으로 건강에 유의하여 주시기 바랍니다.",cbs,화성시,,,"[('발효 야외활동을 자제하여 주시고', 0.7192)]"
2023/07/21 18:19:57,52,경기도 화성시,199154,"최근 울산, 대전 등에서 해외우편물 개봉으로 피해사례가 발생, 출저가 불분명한 해외우편물은 열지 마시고 112나 119에 즉시 신고하시기 바랍니다.",cbs,화성시,,,"[('열지 마시고 112나', 0.7241)]"
2023/07/21 10:34:22,52,경기도 화성시,199084,"현재 폭염주의보 발효중, 건설현장,농작물경작 등 장기간 야외활동을 자제하여 주시고 휴식과 충분한 수분섭취를 통해 건강관리에 유의하여 주시기 바랍니다.",cbs,화성시,,,"[('폭염주의보 발효중 건설현장', 0.7428)]"
2023/07/19 14:44:43,52,경기도 화성시,199004,"폭염주의보 발효중, 낮 시간대 야외활동 자제 및 충분한 수분섭취와 휴식을 취하여 건강관리에 유의하여 주시기 바랍니다.",cbs,화성시,,,"[('발효중 시간대', 0.6632)]"
2023/07/14 08:03:30,52,경기도 화성시,197306,"금일 집중호우가 예상되므로 반지하, 저지대, 산사태 취약, 해안가 주변 주민은 주의하여 주시고 하천 및 해안가 산책로 등 접근을 금지하여 주시기 바랍니다",cbs,화성시,,,"[('하천 해안가 산책로 접근을', 0.7376)]"
2023/07/04 17:54:02,52,경기도 화성시,196446,"금일 밤부터 새벽사이 많은 비가 예상되니 하천변,산사태 등 위험지역 접근자제 및 반지하,저지대 거주민은 침수피해가 발생하지 않도록 대비해주시기 바랍니다.",cbs,화성시,,,"[('밤부터 새벽사이', 0.7513)]"
2023/06/23 09:44:56,52,경기도 화성시,195788,금일 09:12경 향남읍 상신리 904-7에서 메탄올 물질 누출 발생. 인근주민께서는 창문을 닫고 에어컨 중지 등 호흡기관리에 유의바랍니다.,cbs,화성시,,,"[('중지 호흡기관리에', 0.5646)]"
2023/04/24 11:45:24,52,경기도 화성시,194650,오늘 11:15경 화성시 팔탄면 노하리 621-14번지 공장화재 사고 발생. 인근 주민은 외출을 자제하는 등 안전사고 발생에 유의 바랍니다.,cbs,화성시,,,"[('사고 발생 인근', 0.4412)]"
2022/12/23 17:33:07,52,경기도 화성시,187029,"강풍·한파 특보 발효 중으로 강한 추위 대비 보온유지, 동파방지 유의/도로결빙 대비 보행 및 차량 운행 시 미끄럼사고 주의바랍니다.",cbs,화성시,,,"[('발효 중으로 강한 추위', 0.6988)]"
2022/12/21 07:10:37,52,경기도 화성시,186229,"강설에 따른 출근길 교통혼잡이 예상되오니 가급적 대중교통을 이용해주시고, 눈으로 인한 보행 및 운전 시 미끄럼사고에 유의하시기 바랍니다.",cbs,화성시,,,"[('가급적 대중교통을', 0.8053)]"
2022/12/20 18:08:40,52,경기도 화성시,186187,"21일(수) 새벽부터 우리시에 많은 눈이 예상되오니 보행 및 운전 시 미끄럼사고 유의/내 집·점포 앞,지붕 눈 치우기/출근시간 대중교통 이용 바랍니다.",cbs,화성시,수,,"[('출근시간 대중교통', 0.543)]"
2022/12/17 13:59:29,52,경기도 화성시,185631,"강설 및 한파로 인해 도로, 보도 등의 결빙 위험이 있으니 감속운전, 보행자 낙상사고 유의, 내집/점포 앞 눈 치우기에 적극 동참하여 주시기 바랍니다.",cbs,화성시,,,"[('내집 점포 치우기에 적극', 0.7392)]"
2022/12/17 11:48:13,52,경기도 화성시,185614,"오늘 21시 이후 화성시 전역 한파특보 발효예정, 한랭질환 예방을 위해 야외활동 자제,수도관 보온조치,온열기 화재예방 등 안전에 주의하시기바랍니다.",cbs,화성시,,,"[('발효예정 한랭질환 예방을', 0.5922)]"
2021/05/20 10:50:36,52,경기도 화성시,106186,"한시생계지원 신청안내 대상:소득감소자 중 중위소득75%,재산3.5억원이하,타부처 중복지원불가 신청:6.4(금)까지 문의:1577-4200,읍면동사무소",cbs,화성시,금,,"[('한시생계지원 신청안내 대상 소득감소자', 0.5896)]"
2021/03/22 17:54:10,52,경기도 화성시,99263,"4.15이후 만75세이상 어르신(46.12.31이전) 코로나 백신접종, 4.2(금)까지(일요일제외)통리장 방문 시 신청 또는 읍면동접수,1577-4200",cbs,화성시,46.12.31이전,75세,"[('방문 신청 또는 읍면동접수', 0.5477)]"
2021/02/23 11:26:36,52,경기도 화성시,94093,제2차 경기도재난기본소득을 신청하지 않으신분은 지금 바로 basicincome.gg.go.kr 에서 3.14.까지 신청하세요 (콜센터:031-120),cbs,화성시,콜센터:031-120,,"[('경기도재난기본소득을 신청하지', 0.5052)]"
2020/11/27 19:42:41,52,경기도 화성시,68132,"한국수자원공사 수질사고로 향남,장안,팔탄,양감,우정 일부지역에19~24시까지 단수및적수가발생될수있으니 대비하여 주시기바랍니다(031-5189-2446)",cbs,화성시,031-5189-2446,,"[('향남 장안', 0.7124)]"
2020/11/23 16:09:33,52,경기도 화성시,66833,"위기가구긴급생계지원 안내 대상:소득감소자, 중위소득75%, 재산3.5억원 신청기한:11.30.(월)18시 문의:1577-4200,읍면동행정복지센터",cbs,화성시,월,,"[('안내 대상 소득감소자 중위소득75', 0.5442)]"
2020/05/18 15:19:30,52,경기도 화성시,35672,"긴급재난지원금 방문신청, 신용(체크)카드:카드사 연계은행, 선불카드:3.29.기준 주소지 행정복지센터, 세대주 신청(5부제), 평일근무시간 내(토일불가)",cbs,화성시,체크,,"[('연계은행 선불카드 29 기준', 0.6179)]"
2020/01/31 16:03:54,52,경기도 화성시,25120,"신종코로나바이러스감염증의심 신고안내 1339 또는 보건소 (031-5189-1200) 동탄성심병원,화성중앙병원,원광종합병원,남양DS병원 상담바랍니다.",cbs,화성시,031-5189-1200,,"[('동탄성심병원 화성중앙병원 원광종합병원', 0.5155)]"
